Text,Date_with_affect,Date,Price,Open,High,Low,Change
"@CNN just released a book called ""Unprecedented"" which explores the 2016 race and victory. Hope it does well but used worst cover photo of me!",2017-01-02,2017-01-02,102.83,102.38,102.94,102.21,0.61
"Various media outlets and pundits say that I thought I was going to lose the election. Wrong, it all came together in the last week and I thought and felt I would win big, easily over the fabled 270 (306). When they cancelled fireworks, they knew, and so did I.",2017-01-02,2017-01-02,102.83,102.38,102.94,102.21,0.61
"China has been taking out massive amounts of money and wealth from the U.S. in totally one-sided trade, but won't help with North Korea. Nice!",2017-01-03,2017-01-03,103.21,102.88,103.82,102.59,0.37
General Motors is sending Mexican made model of Chevy Cruze to U.S. car dealers-tax free across border. Make in U.S.A.or pay big border tax!,2017-01-03,2017-01-03,103.21,102.88,103.82,102.59,0.37
"People must remember that ObamaCare just doesn't work, and it is not affordable - 116% increases (Arizona). Bill Clinton called it ""CRAZY""",2017-01-03,2017-01-03,103.21,102.88,103.82,102.59,0.37
"The Democrat Governor.of Minnesota said ""The Affordable Care Act (ObamaCare) is no longer affordable!"" - And, it is lousy healthcare.",2017-01-03,2017-01-03,103.21,102.88,103.82,102.59,0.37
"With all that Congress has to work on, do they really have to make the weakening of the Independent Ethics Watchdog, as unfair as it .....may be, their number one act and priority. Focus on tax reform, healthcare and so many other things of far greater importance! #DTS",2017-01-03,2017-01-03,103.21,102.88,103.82,102.59,0.37
"""@DanScavino: Ford to scrap Mexico plant, invest in Michigan due to Trump policies""",2017-01-03,2017-01-03,103.21,102.88,103.82,102.59,0.37
"Instead of driving jobs and wealth away, AMERICA will become the world's great magnet for INNOVATION and JOB CREATION.",2017-01-03,2017-01-03,103.21,102.88,103.82,102.59,0.37
There should be no further releases from Gitmo. These are extremely dangerous people and should not be allowed back onto the battlefield.,2017-01-03,2017-01-03,103.21,102.88,103.82,102.59,0.37
"""Trump is already delivering the jobs he promised America"" ",2017-01-03,2017-01-03,103.21,102.88,103.82,102.59,0.37
North Korea just stated that it is in the final stages of developing a nuclear weapon capable of reaching parts of the U.S. It won't happen!,2017-01-03,2017-01-03,103.21,102.88,103.82,102.59,0.37
"Jackie Evancho's album sales have skyrocketed after announcing her Inauguration performance.Some people just don't understand the ""Movement""",2017-01-04,2017-01-04,102.7,103.17,103.44,102.39,-0.49
"Somebody hacked the DNC but why did they not have ""hacking defense"" like the RNC has and why have they not responded to the terrible things they did and said (like giving the questions to the debate to H). A total double standard! Media, as usual, gave them a pass.",2017-01-04,2017-01-04,102.7,103.17,103.44,102.39,-0.49
Thank you to Ford for scrapping a new plant in Mexico and creating 700 new jobs in the U.S. This is just the beginning - much more to follow,2017-01-04,2017-01-04,102.7,103.17,103.44,102.39,-0.49
"Republicans must be careful in that the Dems own the failed ObamaCare disaster, with its poor coverage and massive premium increases like the 116% hike in Arizona. Also, deductibles are so high that it is practically useless. Don't let the Schumer clowns out of this web massive increases of ObamaCare will take place this year and Dems are to blame for the mess. It will fall of its own weight - be careful!",2017-01-04,2017-01-04,102.7,103.17,103.44,102.39,-0.49
"Julian Assange said ""a 14 year old could have hacked Podesta"" - why was DNC so careless? Also said Russians did not give him the info!",2017-01-04,2017-01-04,102.7,103.17,103.44,102.39,-0.49
"The ""Intelligence"" briefing on so-called ""Russian hacking"" was delayed until Friday, perhaps more time needed to build a case. Very strange!",2017-01-04,2017-01-04,102.7,103.17,103.44,102.39,-0.49
I will be having a general news conference on JANUARY ELEVENTH in N.Y.C. Thank you.,2017-01-04,2017-01-04,102.7,103.17,103.44,102.39,-0.49
"""@FoxNews: Julian Assange on U.S. media coverage: ""It's very dishonest."" #Hannity More dishonest than anyone knows",2017-01-04,2017-01-04,102.7,103.17,103.44,102.39,-0.49
"The Democrats, lead by head clown Chuck Schumer, know how bad ObamaCare is and what a mess they are in. Instead of working to fix it, they do the typical political thing and BLAME. The fact is ObamaCare was a lie from the beginning.""Keep you doctor, keep your plan!"" It is time for Republicans and Democrats to get together and come up with a healthcare plan that really works - much less expensive and FAR BETTER!",2017-01-05,2017-01-05,101.52,102.45,102.51,101.3,-1.15
"The dishonest media likes saying that I am in Agreement with Julian Assange - wrong. I simply state what he states, it is for the people to make up their own minds as to the truth. The media lies to make it look like I am against ""Intelligence"" when in fact I am a big fan!",2017-01-05,2017-01-05,101.52,102.45,102.51,101.3,-1.15
"Toyota Motor said will build a new plant in Baja, Mexico, to build Corolla cars for U.S. NO WAY! Build plant in U.S. or pay big border tax.",2017-01-05,2017-01-05,101.52,102.45,102.51,101.3,-1.15
Monitoring the terrible situation in Florida. Just spoke to Governor Scott. Thoughts and prayers for all. Stay safe!,2017-01-06,2017-01-06,102.22,101.4,102.29,101.37,0.69
I am asking the chairs of the House and Senate committees to investigate top secret intelligence shared with NBC prior to me seeing it.,2017-01-06,2017-01-06,102.22,101.4,102.29,101.37,0.69
"Anna Wintour came to my office at Trump Tower to ask me to meet with the editors of Conde Nast and Steven Newhouse, a friend. Will go this AM.",2017-01-06,2017-01-06,102.22,101.4,102.29,101.37,0.69
"Wow, the ratings are in and Arnold Schwarzenegger got ""swamped"" (or destroyed) by comparison to the ratings machine, DJT. So much for being a movie star-and that was season 1 compared to season 14. Now compare him to my season 1. But who cares, he supported Kasich and Hillary",2017-01-06,2017-01-06,102.22,101.4,102.29,101.37,0.69
"The dishonest media does not report that any money spent on building the Great Wall (for sake of speed), will be paid back by Mexico later!",2017-01-06,2017-01-06,102.22,101.4,102.29,101.37,0.69
Hillary and the Dems were never going to beat the PASSION of my voters. They saw what was happening in the last two weeks before the and knew they were in big trouble - which is why they cancelled their big fireworks at the last minute.THEY SAW A MOVEMENT LIKE NEVER BEFORE,2017-01-06,2017-01-06,102.22,101.4,102.29,101.37,0.69
The Democratic National Committee would not allow the FBI to study or see its computer info after it was supposedly hacked by Russia So how and why are they so sure about hacking if they never even requested an examination of the computer servers? What is going on?,2017-01-06,2017-01-06,102.22,101.4,102.29,101.37,0.69
"How did NBC get ""an exclusive look into the top secret report he (Obama) was presented?"" Who gave them this report and why? Politics!",2017-01-06,2017-01-06,102.22,101.4,102.29,101.37,0.69
"Hopefully, all supporters, and those who want to MAKE AMERICA GREAT AGAIN, will go to D.C. on January 20th. It will be a GREAT SHOW!",2017-01-06,2017-01-06,102.22,101.4,102.29,101.37,0.69
Only reason the hacking of the poorly defended DNC is discussed is that the loss by the Dems was so big that they are totally embarrassed!,2017-01-07,2017-01-09,101.93,102.25,102.52,101.8,-0.28
"Having a good relationship with Russia is a good thing, not a bad thing. Only ""stupid"" people, or fools, would think that it is bad! We have enough problems around the world without yet another one. When I am President, Russia will respect us far more than they do now and both countries will, perhaps, work together to solve some of the many great and pressing problems and issues of the WORLD!",2017-01-07,2017-01-09,101.93,102.25,102.52,101.8,-0.28
Gross negligence by the Democratic National Committee allowed hacking to take place.The Republican National Committee had strong defense!,2017-01-07,2017-01-09,101.93,102.25,102.52,101.8,-0.28
Intelligence stated very strongly there was absolutely no evidence that hacking affected the election results. Voting machines not touched!,2017-01-07,2017-01-09,101.93,102.25,102.52,101.8,-0.28
Congratulation to Jane Timken on her major upset victory in becoming the Ohio Republican Party Chair. Jane is a loyal Trump supporter and star,2017-01-08,2017-01-09,101.93,102.25,102.52,101.8,-0.28
"I look very much forward to meeting Prime Minister Theresa May in Washington in the Spring. Britain, a longtime U.S. ally, is very special!",2017-01-08,2017-01-09,101.93,102.25,102.52,101.8,-0.28
"""@FoxNews: ""We certainly don't want intelligence interfering with politics and we don't want politics interfe... ",2017-01-08,2017-01-09,101.93,102.25,102.52,101.8,-0.28
"Before I, or anyone, saw the classified and/or highly confidential hacking intelligence report, it was leaked out to @NBCNews. So serious!",2017-01-08,2017-01-09,101.93,102.25,102.52,101.8,-0.28
Dishonest media says Mexico won't be paying for the wall if they pay a little later so the wall can be built more quickly. Media is fake!,2017-01-09,2017-01-09,101.93,102.25,102.52,101.8,-0.28
Rupert Murdoch is a great guy who likes me much better as a very successful candidate than he ever did as a very successful developer!,2017-01-09,2017-01-09,101.93,102.25,102.52,101.8,-0.28
"Meryl Streep, one of the most over-rated actresses in Hollywood, doesn't know me but attacked last night at the Golden Globes. She is a Hillary flunky who lost big. For the 100th time, I never ""mocked"" a disabled reporter (would never do that) but simply showed him ""groveling"" when he totally changed a 16 year old story that he had written in order to make me look bad. Just more very dishonest media!",2017-01-09,2017-01-09,101.93,102.25,102.52,101.8,-0.28
"It's finally happening - Fiat Chrysler just announced plans to invest $1BILLION in Michigan and Ohio plants, adding 2000 jobs. This after Ford said last week that it will expand in Michigan and U.S. instead of building a BILLION dollar plant in Mexico. Thank you Ford and Fiat C!",2017-01-09,2017-01-09,101.93,102.25,102.52,101.8,-0.28
Thank you to all of the men and women who protect and serve our communities 24/7/365! #LawEnforcementAppreciationDay ,2017-01-10,2017-01-10,102.01,101.85,102.1,101.51,0.08
'U.S. Small-Business Optimism Index Surges by Most Since 1980',2017-01-10,2017-01-10,102.01,101.85,102.1,101.51,0.08
'Small business optimism soars after Trump election' ,2017-01-10,2017-01-10,102.01,101.85,102.1,101.51,0.08
"I win an election easily, a great ""movement"" is verified, and crooked opponents try to belittle our victory with FAKE NEWS. A sorry state!",2017-01-11,2017-01-11,101.78,102.07,102.95,101.28,-0.23
"Intelligence agencies should never have allowed this fake news to ""leak"" into the public. One last shot at me.Are we living in Nazi Germany?",2017-01-11,2017-01-11,101.78,102.07,102.95,101.28,-0.23
"Russia just said the unverified report paid for by political opponents is ""A COMPLETE AND TOTAL FABRICATION, UTTER NONSENSE."" Very unfair!",2017-01-11,2017-01-11,101.78,102.07,102.95,101.28,-0.23
'Trump Helps Lift Small Business Confidence to 12-Yr. High' ,2017-01-11,2017-01-11,101.78,102.07,102.95,101.28,-0.23
"Russia has never tried to use leverage over me. I HAVE NOTHING TO DO WITH RUSSIA - NO DEALS, NO LOANS, NO NOTHING!",2017-01-11,2017-01-11,101.78,102.07,102.95,101.28,-0.23
We had a great News Conference at Trump Tower today. A couple of FAKE NEWS organizations were there but the people truly get what's going on,2017-01-12,2017-01-12,101.35,101.67,101.8,100.72,-0.42
"""@zhu_amy3: @realDonaldTrump It's Morning in America again!!! Thank you President-Elect Donald Trump!!! So proud of you!!!!"" THANKS!",2017-01-12,2017-01-12,101.35,101.67,101.8,100.72,-0.42
"James Clapper called me yesterday to denounce the false and fictitious report that was illegally circulated. Made up, phony facts.Too bad!",2017-01-12,2017-01-12,101.35,101.67,101.8,100.72,-0.42
Thank you to Linda Bean of L.L.Bean for your great support and courage. People will support you even more now. Buy L.L.Bean. @LBPerfectMaine,2017-01-12,2017-01-12,101.35,101.67,101.8,100.72,-0.42
.@CNN is in a total meltdown with their FAKE NEWS because their ratings are tanking since election and their credibility will soon be gone!,2017-01-12,2017-01-12,101.35,101.67,101.8,100.72,-0.42
Congrats to the Senate for taking the first step to #RepealObamacare- now it's onto the House!,2017-01-12,2017-01-12,101.35,101.67,101.8,100.72,-0.42
"A beautiful funeral today for a real NYC hero, Detective Steven McDonald. Our law enforcement community has my complete and total support.",2017-01-13,2017-01-13,101.18,101.51,101.67,101.01,-0.17
"The ""Unaffordable"" Care Act will soon be history!",2017-01-13,2017-01-13,101.18,101.51,101.67,101.01,-0.17
"All of my Cabinet nominee are looking good and doing a great job. I want them to be themselves and express their own thoughts, not mine!",2017-01-13,2017-01-13,101.18,101.51,101.67,101.01,-0.17
"It now turns out that the phony allegations against me were put together by my political opponents and a failed spy afraid of being sued Totally made up facts by sleazebag political operatives, both Democrats and Republicans - FAKE NEWS! Russia says nothing exists. Probably released by ""Intelligence"" even knowing there is no proof, and never will be. My people will have a full report on hacking within 90 days!",2017-01-13,2017-01-13,101.18,101.51,101.67,101.01,-0.17
What are Hillary Clinton's people complaining about with respect to the F.B.I. Based on the information they had she should never have been allowed to run - guilty as hell. They were VERY nice to her. She lost because she campaigned in the wrong states - no enthusiasm!,2017-01-13,2017-01-13,101.18,101.51,101.67,101.01,-0.17
"Congressman John Lewis should spend more time on fixing and helping his district, which is in horrible shape and falling apart (not to mention crime infested) rather than falsely complaining about the election results. All talk, talk, talk - no action or results. Sad!",2017-01-14,2017-01-16,101.18,101.66,101.73,101.32,0.0
"INTELLIGENCE INSIDERS NOW CLAIM THE TRUMP DOSSIER IS ""A COMPLETE FRAUD!"" @OANN",2017-01-14,2017-01-16,101.18,101.66,101.73,101.32,0.0
"Thank you to Bob Woodward who said, ""That is a garbage document...it never should have been presented...Trump's right to be upset (angry) about that...Those Intelligence chiefs made a mistake here, and when people make mistakes, they should APOLOGIZE."" Media should also apologize",2017-01-15,2017-01-16,101.18,101.66,101.73,101.32,0.0
"will only get higher. Car companies and others, if they want to do business in our country, have to start making things here again. WIN!",2017-01-15,2017-01-16,101.18,101.66,101.73,101.32,0.0
"For many years our country has been divided, angry and untrusting. Many say it will never change, the hatred is too deep. IT WILL CHANGE!!!!",2017-01-15,2017-01-16,101.18,101.66,101.73,101.32,0.0
"Inauguration Day is turning out to be even bigger than expected. January 20th, Washington D.C. Have fun!",2017-01-15,2017-01-16,101.18,101.66,101.73,101.32,0.0
"The Democrats are most angry that so many Obama Democrats voted for me. With all of the jobs I am bringing back to our Nation, that number..",2017-01-15,2017-01-16,101.18,101.66,101.73,101.32,0.0
Congressman John Lewis should finally focus on the burning and crime infested inner-cities of the U.S. I can use all the help I can get!,2017-01-15,2017-01-16,101.18,101.66,101.73,101.32,0.0
".@NBCNews is bad but Saturday Night Live is the worst of NBC. Not funny, cast is terrible, always a complete hit job. Really bad television!",2017-01-16,2017-01-16,101.18,101.66,101.73,101.32,0.0
".@FoxNews ""Outgoing CIA Chief, John Brennan, blasts Pres-Elect Trump on Russia threat. Does not fully understand."" Oh really, couldn't do much worse - just look at Syria (red line), Crimea, Ukraine and the build-up of Russian nukes. Not good! Was this the leaker of Fake News?",2017-01-16,2017-01-16,101.18,101.66,101.73,101.32,0.0
Celebrate Martin Luther King Day and all of the many wonderful things that he stood for. Honor him for being the great man that he was!,2017-01-16,2017-01-16,101.18,101.66,101.73,101.32,0.0
"""@levisteveholt: @realDonaldTrump I appreciate your use of Twitter to keep us informed and maintain transparency."" Very dishonest media!",2017-01-17,2017-01-17,100.33,101.54,101.62,100.26,-0.84
"At 9:00 P.M. @CNN, of all places, is doing a Special Report on my daughter, Ivanka. Considering it is CNN, can't imagine it will be great!",2017-01-17,2017-01-17,100.33,101.54,101.62,100.26,-0.84
"""@drgoodspine: @realDonaldTrump @Ivanka Trump is great, a woman with real character and class.""",2017-01-17,2017-01-17,100.33,101.54,101.62,100.26,-0.84
"People are pouring into Washington in record numbers. Bikers for Trump are on their way. It will be a great Thursday, Friday and Saturday!",2017-01-17,2017-01-17,100.33,101.54,101.62,100.26,-0.84
"The same people who did the phony election polls, and were so wrong, are now doing approval rating polls. They are rigged just like before.",2017-01-17,2017-01-17,100.33,101.54,101.62,100.26,-0.84
"With all of the jobs I am bringing back into the U.S. (even before taking office), with all of the new auto plants coming back into our country and with the massive cost reductions I have negotiated on military purchases and more, I believe the people are seeing ""big stuff.""",2017-01-17,2017-01-17,100.33,101.54,101.62,100.26,-0.84
"John Lewis said about my inauguration, ""It will be the first one that I've missed."" WRONG (or lie)! He boycotted Bush 43 also because he ""thought it would be hypocritical to attend Bush's swearing-in....he doesn't believe Bush is the true elected president."" Sound familiar! WP",2017-01-17,2017-01-17,100.33,101.54,101.62,100.26,-0.84
Thank you to General Motors and Walmart for starting the big jobs push back into the U.S.!,2017-01-17,2017-01-17,100.33,101.54,101.62,100.26,-0.84
No wonder the Today Show on biased @NBC is doing so badly compared to its glorious past. Little credibility!,2017-01-18,2017-01-18,100.93,100.43,101.34,100.32,0.6
.@TheAlabamaBand was great last night in D.C. playing for 147 Diplomats and Ambassadors from countries around the world. Thanks Alabama!,2017-01-18,2017-01-18,100.93,100.43,101.34,100.32,0.6
"Writing my inaugural address at the Winter White House, Mar-a-Lago, three weeks ago. Looking forward to Friday. #Inauguration ",2017-01-18,2017-01-18,100.93,100.43,101.34,100.32,0.6
"Getting ready to leave for Washington, D.C. The journey begins and I will be working and fighting very hard to make it a great journey for..",2017-01-19,2017-01-19,101.15,101.35,101.73,100.97,0.22
Thank you to our amazing Wounded Warriors for their service. It was an honor to be with them tonight in D.C. #Heroes ,2017-01-19,2017-01-19,101.15,101.35,101.73,100.97,0.22
"""It wasn't Donald Trump that divided this country, this country has been divided for a long time!"" Stated today by Reverend Franklin Graham.",2017-01-19,2017-01-19,101.15,101.35,101.73,100.97,0.22
"Looking forward to a speedy recovery for George and Barbara Bush, both hospitalized. Thank you for your wonderful letter!",2017-01-19,2017-01-19,101.15,101.35,101.73,100.97,0.22
It all begins today! I will see you at 11:00 A.M. for the swearing-in. THE MOVEMENT CONTINUES - THE WORK BEGINS!,2017-01-20,2017-01-20,100.74,101.17,101.5,100.7,-0.41
"Today we are not merely transferring power from one Administration to another, or from one party to another - but we are transferring power from Washington, D.C. and giving it back to you, the American People. #InaugurationDay",2017-01-20,2017-01-20,100.74,101.17,101.5,100.7,-0.41
"What truly matters is not which party controls our government, but whether our government is controlled by the people.",2017-01-20,2017-01-20,100.74,101.17,101.5,100.7,-0.41
"January 20th 2017, will be remembered as the day the people became the rulers of this nation again.",2017-01-20,2017-01-20,100.74,101.17,101.5,100.7,-0.41
"The forgotten men and women of our country will be forgotten no longer. From this moment on, it's going to be #AmericaFirst",2017-01-20,2017-01-20,100.74,101.17,101.5,100.7,-0.41
We will bring back our jobs. We will bring back our borders. We will bring back our wealth - and we will bring back our dreams!,2017-01-20,2017-01-20,100.74,101.17,101.5,100.7,-0.41
We will follow two simple rules: BUY AMERICAN and HIRE AMERICAN!#InaugurationDay #MAGA,2017-01-20,2017-01-20,100.74,101.17,101.5,100.7,-0.41
"So to all Americans, in every city near and far, small and large, from mountain to mountain..",2017-01-20,2017-01-20,100.74,101.17,101.5,100.7,-0.41
A fantastic day and evening in Washington D.C.Thank you to @FoxNews and so many other news outlets for the GREAT reviews of the speech!,2017-01-21,2017-01-23,100.16,100.74,100.74,99.9,-0.58
"Peaceful protests are a hallmark of our democracy. Even if I don't always agree, I recognize the rights of people to express their views.",2017-01-22,2017-01-23,100.16,100.74,100.74,99.9,-0.58
"Had a great meeting at CIA Headquarters yesterday, packed house, paid great respect to Wall, long standing ovations, amazing people. WIN!",2017-01-22,2017-01-23,100.16,100.74,100.74,99.9,-0.58
Watched protests yesterday but was under the impression that we just had an election! Why didn't these people vote? Celebs hurt cause badly.,2017-01-22,2017-01-23,100.16,100.74,100.74,99.9,-0.58
"Wow, television ratings just out: 31 million people watched the Inauguration, 11 million more than the very good ratings from 4 years ago!",2017-01-22,2017-01-23,100.16,100.74,100.74,99.9,-0.58
Busy week planned with a heavy focus on jobs and national security. Top executives coming in at 9:00 A.M. to talk manufacturing in America.,2017-01-23,2017-01-23,100.16,100.74,100.74,99.9,-0.58
A photo delivered yesterday that will be displayed in the upper/lower press hall. Thank you Abbas! ,2017-01-24,2017-01-24,100.35,100.08,100.43,99.92,0.19
"Great meeting with automobile industry leaders at the @WhiteHouse this morning. Together, we will #MAGA! ",2017-01-24,2017-01-24,100.35,100.08,100.43,99.92,0.19
Signing orders to move forward with the construction of the Keystone XL and Dakota Access pipelines in the Oval Office. ,2017-01-24,2017-01-24,100.35,100.08,100.43,99.92,0.19
Will be meeting at 9:00 with top automobile executives concerning jobs in America. I want new plants to be built here for cars sold here!,2017-01-24,2017-01-24,100.35,100.08,100.43,99.92,0.19
Great meeting with Ford CEO Mark Fields and General Motors CEO Mary Barra at the @WhiteHouse today. ,2017-01-25,2017-01-25,100.03,100.31,100.41,99.83,-0.32
Congratulations to @FoxNews for being number one in inauguration ratings. They were many times higher than FAKE NEWS @CNN - public is smart!,2017-01-25,2017-01-25,100.03,100.31,100.41,99.83,-0.32
"If Chicago doesn't fix the horrible ""carnage"" going on, 228 shootings in 2017 with 42 killings (up 24% from 2016), I will send in the Feds!",2017-01-25,2017-01-25,100.03,100.31,100.41,99.83,-0.32
"Big day planned on NATIONAL SECURITY tomorrow. Among many other things, we will build the wall!",2017-01-25,2017-01-25,100.03,100.31,100.41,99.83,-0.32
"I will be asking for a major investigation into VOTER FRAUD, including those registered to vote in two states, those who are illegal and even, those registered to vote who are dead (and many for a long time). Depending on results, we will strengthen up voting procedures!",2017-01-25,2017-01-25,100.03,100.31,100.41,99.83,-0.32
I will be making my Supreme Court pick on Thursday of next week.Thank you!,2017-01-25,2017-01-25,100.03,100.31,100.41,99.83,-0.32
"Spoke at the Congressional @GOP Retreat in Philadelphia, PA. this afternoon w/ @VP, @SenateMajLdr, @SpeakerRyan. Thank you for your support! ",2017-01-26,2017-01-26,100.38,99.91,100.73,99.79,0.35
"The U.S. has a 60 billion dollar trade deficit with Mexico. It has been a one-sided deal from the beginning of NAFTA with massive numbers of jobs and companies lost. If Mexico is unwilling to pay for the badly needed wall, then it would be better to cancel the upcoming meeting.",2017-01-26,2017-01-26,100.38,99.91,100.73,99.79,0.35
"Ungrateful TRAITOR Chelsea Manning, who should never have been released from prison, is now calling President Obama a weak leader. Terrible!",2017-01-26,2017-01-26,100.38,99.91,100.73,99.79,0.35
"Beginning today, the United States of America gets back control of its borders. Full speech from today @DHSgov: ",2017-01-26,2017-01-26,100.38,99.91,100.73,99.79,0.35
"""@romoabcnews: .@DavidMuir first @POTUS interview since taking office. Tonight on @ABCWorldNews @ABC2020 tonight. ",2017-01-26,2017-01-26,100.38,99.91,100.73,99.79,0.35
"As your President, I have no higher duty than to protect the lives of the American people. ",2017-01-26,2017-01-26,100.38,99.91,100.73,99.79,0.35
Interview with David Muir of @ABC News in 10 minutes. Enjoy!,2017-01-26,2017-01-26,100.38,99.91,100.73,99.79,0.35
Statement on International Holocaust Remembrance Day: ,2017-01-27,2017-01-27,100.53,100.49,100.82,100.32,0.15
.@VP Mike Pence will be speaking at today's #MarchForLife -- You have our full support! ,2017-01-27,2017-01-27,100.53,100.49,100.82,100.32,0.15
