Text,Date_with_affect,Date,Price,Open,High,Low,Change
"Cryin' Chuck Schumer stated recently, ""I do not have confidence in him (James Comey) any longer."" Then acts so indignant. #draintheswamp",2017-05-10,2017-05-10,99.67,99.48,99.72,99.36,0.01
"The Democrats have said some of the worst things about James Comey, including the fact that he should be fired, but now they play so sad!",2017-05-10,2017-05-10,99.67,99.48,99.72,99.36,0.01
"James Comey will be replaced by someone who will do a far better job, bringing back the spirit and prestige of the FBI.",2017-05-10,2017-05-10,99.67,99.48,99.72,99.36,0.01
"RT @DRUDGE_REPORT: MEXICO 2ND DEADLIEST COUNTRY; TOPS AFGHAN, IRAQ... ",2017-05-10,2017-05-10,99.67,99.48,99.72,99.36,0.01
"Comey lost the confidence of almost everyone in Washington, Republican and Democrat alike. When things calm down, they will be thanking me!",2017-05-10,2017-05-10,99.67,99.48,99.72,99.36,0.01
"Watching Senator Richard Blumenthal speak of Comey is a joke. ""Richie"" devised one of the greatest military frauds in U.S. history. For years, as a pol in Connecticut, Blumenthal would talk of his great bravery and conquests in Vietnam - except he was never there. When caught, he cried like a baby and begged for forgiveness...and now he is judge and jury. He should be the one who is investigated for his acts.",2017-05-10,2017-05-10,99.67,99.48,99.72,99.36,0.01
The Roger Stone report on @CNN is false - Fake News. Have not spoken to Roger in a long time - had nothing to do with my decision.,2017-05-10,2017-05-10,99.67,99.48,99.72,99.36,0.01
Dems have been complaining for months and months about Dir. Comey. Now that he has been fired they PRETEND to be aggrieved. Phony hypocrites!,2017-05-10,2017-05-10,99.67,99.48,99.72,99.36,0.01
'Presidential Executive Order on the Establishment of Presidential Advisory Commission on Election Integrity' ,2017-05-11,2017-05-11,99.62,99.66,99.89,99.49,-0.05
"Yesterday, on the same day- I had meetings with Russian Foreign Minister Sergei Lavrov and the FM of Ukraine, Pavlo Klimkin.#LetsMakePeace! ",2017-05-11,2017-05-11,99.62,99.66,99.89,99.49,-0.05
Russia must be laughing up their sleeves watching as the U.S. tears itself apart over a Democrat EXCUSE for losing the election.,2017-05-11,2017-05-11,99.62,99.66,99.89,99.49,-0.05
'Presidential Executive Order on Strengthening the Cybersecurity of Federal Networks and Critical Infrastructure' ,2017-05-11,2017-05-11,99.62,99.66,99.89,99.49,-0.05
The Democrats should be ashamed. This is a disgrace!#DrainTheSwamp ,2017-05-11,2017-05-11,99.62,99.66,99.89,99.49,-0.05
"Today, I welcomed the Victory Christian Center School. Good luck @ the Team America Rocketry Challenge! #TARC Watch: ",2017-05-12,2017-05-12,99.25,99.63,99.7,99.16,-0.37
"Today, @FLOTUS hosted a Military Mother's Day Event in the East Room of the WH. It was an honor to stop by, say hello, and introduce Melania! ",2017-05-12,2017-05-12,99.25,99.63,99.7,99.16,-0.37
"China just agreed that the U.S. will be allowed to sell beef, and other major products, into China once again. This is REAL news!",2017-05-12,2017-05-12,99.25,99.63,99.7,99.16,-0.37
"Again, the story that there was collusion between the Russians and Trump campaign was fabricated by Dems as an excuse for losing the election.",2017-05-12,2017-05-12,99.25,99.63,99.7,99.16,-0.37
"James Comey better hope that there are no ""tapes"" of our conversations before he starts leaking to the press!",2017-05-12,2017-05-12,99.25,99.63,99.7,99.16,-0.37
"When James Clapper himself, and virtually everyone else with knowledge of the witch hunt, says there is no collusion, when does it end?",2017-05-12,2017-05-12,99.25,99.63,99.7,99.16,-0.37
"As a very active President with lots of things happening, it is not possible for my surrogates to stand at podium with perfect accuracy! Maybe the best thing to do would be to cancel all future ""press briefings"" and hand out written responses for the sake of accuracy???",2017-05-12,2017-05-12,99.25,99.63,99.7,99.16,-0.37
"I was thrilled to be back @LibertyU. Congratulations to the Class of 2017! This is your day, and you've earned it. ",2017-05-13,2017-05-15,98.91,99.15,99.26,98.79,-0.34
Wishing @FLOTUS Melania and all of the great mothers out there a wonderful day ahead with family and friends! Happy #MothersDay,2017-05-14,2017-05-15,98.91,99.15,99.26,98.79,-0.34
"Today, I delivered remarks at the 36th Annual National Peace Officers' Memorial Service. #NationalPoliceWeekWatch: ",2017-05-15,2017-05-15,98.91,99.15,99.26,98.79,-0.34
#PeaceOfficersMemorialDay and#PoliceWeek Proclamation: ,2017-05-16,2017-05-16,98.11,98.88,98.89,98.08,-0.81
"As President I wanted to share with Russia (at an openly scheduled W.H. meeting) which I have the absolute right to do, facts pertaining to terrorism and airline flight safety. Humanitarian reasons, plus I want Russia to greatly step up their fight against ISIS and terrorism.",2017-05-16,2017-05-16,98.11,98.88,98.89,98.08,-0.81
"I have been asking Director Comey and others, from the beginning of my administration, to find the LEAKERS in the intelligence community 'U.S. Industrial Production Surged in April' ",2017-05-16,2017-05-16,98.11,98.88,98.89,98.08,-0.81
"It was a great honor to welcome the President of Turkey, Recep Tayyip Erdogan, to the @WhiteHouse today! ",2017-05-16,2017-05-16,98.11,98.88,98.89,98.08,-0.81
It was my great honor to deliver the #CGACommencement17 at the @USCGAcademy. CONGRATULATIONS to the Class of 2017! ,2017-05-17,2017-05-17,97.58,98.09,98.13,97.33,-0.54
This is the single greatest witch hunt of a politician in American history!,2017-05-18,2017-05-18,97.88,97.44,98.07,97.37,0.31
"With all of the illegal acts that took place in the Clinton campaign and Obama Administration, there was never a special counsel appointed!",2017-05-18,2017-05-18,97.88,97.44,98.07,97.37,0.31
A great honor to welcome President Juan Manuel Santos of Colombia to the White House today! Joint Press Conf ,2017-05-19,2017-05-19,97.14,97.85,97.85,97.08,-0.76
"""President Donald J. Trump Proclaims 5/14/2017 through 5/20/2017 as #PoliceWeek""Proclamation #ThankACop #LESM ",2017-05-19,2017-05-19,97.14,97.85,97.85,97.08,-0.76
Getting ready for my big foreign trip. Will be strongly protecting American interests - that's what I like to do!,2017-05-19,2017-05-19,97.14,97.85,97.85,97.08,-0.76
"Thank you to the BRAVE servicemen and women who have served, and continue to serve the United States- our true HEROES! #ArmedForcesDay ",2017-05-20,2017-05-22,96.98,97.22,97.44,96.8,-0.16
"Great to be in Riyadh, Saudi Arabia. Looking forward to the afternoon and evening ahead. #POTUSAbroad ",2017-05-20,2017-05-22,96.98,97.22,97.44,96.8,-0.16
RT @FLOTUS: I had a wonderful time with the students at the American International School #Riyadh today. #SaudiaArabia ,2017-05-21,2017-05-22,96.98,97.22,97.44,96.8,-0.16
"Israel, Saudi Arabia and the Middle East were great. Trying hard for PEACE. Doing well. Heading to Vatican and Pope, then #G7 and #NATO.",2017-05-23,2017-05-23,97.35,96.95,97.42,96.8,0.38
All civilized nations must join together to protect human life and the sacred right of our citizens to live in safety and in peace.,2017-05-23,2017-05-23,97.35,96.95,97.42,96.8,0.38
Honor of a lifetime to meet His Holiness Pope Francis. I leave the Vatican more determined than ever to pursue PEACE in our world. ,2017-05-24,2017-05-24,97.24,97.34,97.47,97.03,-0.11
RT @FLOTUS: Thank u to Queen Fabiola University Hospital! Enjoyed creating paper flowers with amazing patients and getting a tour. #Brussels...,2017-05-25,2017-05-25,97.25,97.07,97.28,96.88,0.01
Today's ceremony is a day for both remembrance and resolve.#NATOMeeting #NATO ,2017-05-25,2017-05-25,97.25,97.07,97.28,96.88,0.01
"Thank you for your support. Together, we will MAKE AMERICA SAFE AND GREAT AGAIN!#POTUSAbroad #USA ",2017-05-25,2017-05-25,97.25,97.07,97.28,96.88,0.01
Just arrived in Italy for the G7. Trip has been very successful. We made and saved the USA many billions of dollars and millions of jobs.,2017-05-26,2017-05-26,97.44,97.23,97.55,97.04,0.2
"Getting ready to engage G7 leaders on many issues including economic growth, terrorism, and security.",2017-05-26,2017-05-26,97.44,97.23,97.55,97.04,0.2
Terrorists are engaged in a war against civilization- it is up to all who value life to confront and defeat this evil,2017-05-26,2017-05-26,97.44,97.23,97.55,97.04,0.2
"On behalf of @FLOTUS Melania and myself, thank you for a wonderful dinner and evening, President Sergio Mattarella. #G7Taormina ",2017-05-26,2017-05-26,97.44,97.23,97.55,97.04,0.2
"Bringing hundreds of billions of dollars back to the U.S.A. from the Middle East - which will mean JOBS, JOBS, JOBS!",2017-05-27,2017-05-29,97.44,97.43,97.61,97.33,0.0
I look forward to reading the @CommerceGov 232 analysis of steel and aluminum- to be released in June. Will take major action if necessary.,2017-05-27,2017-05-29,97.44,97.43,97.61,97.33,0.0
"Just left the #G7Summit. Had great meetings on everything, especially on trade where .""we push for the removal of all trade-distorting practices....to foster a truly level playing field.""",2017-05-27,2017-05-29,97.44,97.43,97.61,97.33,0.0
"Many NATO countries have agreed to step up payments considerably, as they should. Money is beginning to pour in- NATO will be much stronger.",2017-05-27,2017-05-29,97.44,97.43,97.61,97.33,0.0
"Big G7 meetings today. Lots of very important matters under discussion. First on the list, of course, is terrorism. #G7Taormina",2017-05-27,2017-05-29,97.44,97.43,97.61,97.33,0.0
I will make my final decision on the Paris Accord next week!,2017-05-27,2017-05-29,97.44,97.43,97.61,97.33,0.0
Big win in Montana for Republicans!,2017-05-28,2017-05-29,97.44,97.43,97.61,97.33,0.0
Just returned from Europe. Trip was a great success for America. Hard work but big results!,2017-05-28,2017-05-29,97.44,97.43,97.61,97.33,0.0
It is my opinion that many of the leaks coming out of the White House are fabricated lies made up by the #FakeNews media.,2017-05-28,2017-05-29,97.44,97.43,97.61,97.33,0.0
"Whenever you see the words 'sources say' in the fake news media, and they don't mention names .it is very possible that those sources don't exist but are made up by fake news writers. #FakeNews is the enemy!",2017-05-28,2017-05-29,97.44,97.43,97.61,97.33,0.0
Does anyone notice how the Montana Congressional race was such a big deal to Dems and Fake News until the Republican won? V was poorly covered,2017-05-28,2017-05-29,97.44,97.43,97.61,97.33,0.0
British Prime Minister May was very angry that the info the U.K. gave to U.S. about Manchester was leaked. Gave me full details!,2017-05-28,2017-05-29,97.44,97.43,97.61,97.33,0.0
I look forward to paying my respects to our brave men and women on this Memorial Day at Arlington National Cemetery later this morning.,2017-05-29,2017-05-29,97.44,97.43,97.61,97.33,0.0
"Today we remember the men and women who made the ultimate sacrifice in serving. Thank you, God bless your families and God bless the USA!",2017-05-29,2017-05-29,97.44,97.43,97.61,97.33,0.0
"North Korea has shown great disrespect for their neighbor, China, by shooting off yet another ballistic missile...but China is trying hard!",2017-05-29,2017-05-29,97.44,97.43,97.61,97.33,0.0
I suggest that we add more dollars to Healthcare and make it the best anywhere. ObamaCare is dead - the Republicans will do much better!,2017-05-29,2017-05-29,97.44,97.43,97.61,97.33,0.0
The Fake News Media works hard at disparaging and demeaning my use of social media because they don't want America to hear the real story!,2017-05-29,2017-05-29,97.44,97.43,97.61,97.33,0.0
"The massive TAX CUTS/REFORM that I have submitted is moving along in the process very well, actually ahead of schedule. Big benefits to all!",2017-05-29,2017-05-29,97.44,97.43,97.61,97.33,0.0
"Honoring the men and women who made the ultimate sacrifice in service to America. Home of the free, because of the brave. #MemorialDay",2017-05-29,2017-05-29,97.44,97.43,97.61,97.33,0.0
"RT @foxandfriends: Jared Kushner didn't suggest Russian communications channel in meeting, source says ",2017-05-30,2017-05-30,97.28,97.63,97.78,97.22,-0.16
RT @Scavino45: President Trump pays respects and delivers #MemorialDay remarks at Arlington National Cemetery. ,2017-05-30,2017-05-30,97.28,97.63,97.78,97.22,-0.16
"We have a MASSIVE trade deficit with Germany, plus they pay FAR LESS than they should on NATO and military. Very bad for U.S. This will change",2017-05-30,2017-05-30,97.28,97.63,97.78,97.22,-0.16
Russian officials must be laughing at the U.S. and how a lame excuse for why the Dems lost the election has taken over the Fake News.,2017-05-30,2017-05-30,97.28,97.63,97.78,97.22,-0.16
"The U.S. Senate should switch to 51 votes, immediately, and get Healthcare and TAX CUTS approved, fast and easy. Dems would do it, no doubt!",2017-05-30,2017-05-30,97.28,97.63,97.78,97.22,-0.16
"So now it is reported that the Democrats, who have excoriated Carter Page about Russia, don't want him to testify. He blows away their case against him and now wants to clear his name by showing ""the false or misleading testimony by James Comey, John Brennan..."" Witch Hunt!",2017-05-31,2017-05-31,96.92,97.43,97.5,96.86,-0.37
"Kathy Griffin should be ashamed of herself. My children, especially my 11 year old son, Barron, are having a hard time with this. Sick!",2017-05-31,2017-05-31,96.92,97.43,97.5,96.86,-0.37
"Hopefully Republican Senators, good people all, can quickly get together and pass a new (repeal and replace) HEALTHCARE bill. Add saved $'s.",2017-05-31,2017-05-31,96.92,97.43,97.5,96.86,-0.37
I will be announcing my decision on the Paris Accord over the next few days. MAKE AMERICA GREAT AGAIN!,2017-05-31,2017-05-31,96.92,97.43,97.5,96.86,-0.37
"We traveled the world to strengthen long-standing alliances, and to form new partnerships. See more at: ",2017-05-31,2017-05-31,96.92,97.43,97.5,96.86,-0.37
"It was an honor to welcome the Prime Minister of Vietnam, Nguyen Xuan Phuc to the @WhiteHouse this afternoon. ",2017-05-31,2017-05-31,96.92,97.43,97.5,96.86,-0.37
"Crooked Hillary Clinton now blames everybody but herself, refuses to say she was a terrible candidate. Hits Facebook and even Dems and DNC.",2017-06-01,2017-06-01,97.2,96.99,97.32,96.9,0.29
"I will be announcing my decision on Paris Accord, Thursday at 3:00 P.M. The White House Rose Garden. MAKE AMERICA GREAT AGAIN!",2017-06-01,2017-06-01,97.2,96.99,97.32,96.9,0.29
"The big story is the ""unmasking and surveillance"" of people that took place during the Obama Administration.",2017-06-01,2017-06-01,97.2,96.99,97.32,96.9,0.29
RT @LindseyGrahamSC: I support President Trump's desire to re-enter the Paris Accord after the agreement becomes a better deal for America...,2017-06-02,2017-06-02,96.72,97.19,97.31,96.65,-0.49
RT @Reince45: Promise kept. @POTUS exits flawed #ParisAccord to seek better deal for U.S. workers and economy. This WH will always put #Ameri...,2017-06-02,2017-06-02,96.72,97.19,97.31,96.65,-0.49
RT @GOPLeader: .@POTUS made the right call in leaving a deal that would have put an unnecessary burden on the United States. ,2017-06-02,2017-06-02,96.72,97.19,97.31,96.65,-0.49
"RT @VP: Our President is choosing to put American jobs, American consumers, American energy, and American industry first. ",2017-06-02,2017-06-02,96.72,97.19,97.31,96.65,-0.49
RT @Jim_Jordan: President Trump did the right thing by withdrawing us from Paris treaty - it would hurt American companies and American wor...,2017-06-02,2017-06-02,96.72,97.19,97.31,96.65,-0.49
RT @foxandfriends: Wall Street hits record highs after Trump pulls out of Climate pact ,2017-06-02,2017-06-02,96.72,97.19,97.31,96.65,-0.49
My job as President is to do everything within my power to give America a level playing field. #AmericaFirst ,2017-06-02,2017-06-02,96.72,97.19,97.31,96.65,-0.49
RT @DRUDGE_REPORT: Fears of new terror attack after van 'mows down 20 people' on London Bridge...,2017-06-04,2017-06-05,96.8,96.73,96.97,96.7,0.08
"We need to be smart, vigilant and tough. We need the courts to give us back our rights. We need the Travel Ban as an extra level of safety!",2017-06-04,2017-06-05,96.8,96.73,96.97,96.7,0.08
"Whatever the United States can do to help out in London and the U. K., we will be there - WE ARE WITH YOU. GOD BLESS!",2017-06-04,2017-06-05,96.8,96.73,96.97,96.7,0.08
We must stop being politically correct and get down to the business of security for our people. If we don't get smart it will only get worse,2017-06-04,2017-06-05,96.8,96.73,96.97,96.7,0.08
"At least 7 dead and 48 wounded in terror attack and Mayor of London says there is ""no reason to be alarmed!""",2017-06-04,2017-06-05,96.8,96.73,96.97,96.7,0.08
Do you notice we are not having a gun debate right now? That's because they used knives and a truck!,2017-06-04,2017-06-05,96.8,96.73,96.97,96.7,0.08
"Today, I announced an Air Traffic Control Initiative to take American air travel into the future - finally! ",2017-06-05,2017-06-05,96.8,96.73,96.97,96.7,0.08
.@SecShulkin's decision is one of the biggest wins for our VETERANS in decades. Our HEROES deserve the best! ,2017-06-05,2017-06-05,96.8,96.73,96.97,96.7,0.08
"Pathetic excuse by London Mayor Sadiq Khan who had to think fast on his ""no reason to be alarmed"" statement. MSM is working hard to sell it!",2017-06-05,2017-06-05,96.8,96.73,96.97,96.7,0.08
In any event we are EXTREME VETTING people coming into the U.S. in order to help keep our country safe. The courts are slow and political!,2017-06-05,2017-06-05,96.8,96.73,96.97,96.7,0.08
The Justice Dept. should ask for an expedited hearing of the watered down Travel Ban before the Supreme Court - and seek much tougher version!,2017-06-05,2017-06-05,96.8,96.73,96.97,96.7,0.08
"The Justice Dept. should have stayed with the original Travel Ban, not the watered down, politically correct version they submitted to S.C.",2017-06-05,2017-06-05,96.8,96.73,96.97,96.7,0.08
"People, the lawyers and the courts can call it whatever they want, but I am calling it what we need and what it is, a TRAVEL BAN!",2017-06-05,2017-06-05,96.8,96.73,96.97,96.7,0.08
".@foxandfriends Dems are taking forever to approve my people, including Ambassadors. They are nothing but OBSTRUCTIONISTS! Want approvals.",2017-06-05,2017-06-05,96.8,96.73,96.97,96.7,0.08
"Sorry folks, but if I would have relied on the Fake News of CNN, NBC, ABC, CBS, washpost or nytimes, I would have had ZERO chance winning WH",2017-06-06,2017-06-06,96.64,96.79,96.8,96.52,-0.17
Today we remember the courage and bravery of our troops that stormed the beaches of Normandy 73 years ago. #DDay #Heroes ,2017-06-06,2017-06-06,96.64,96.79,96.8,96.52,-0.17
"So good to see the Saudi Arabia visit with the King and 50 countries already paying off. They said they would take a hard line on funding extremism, and all reference was pointing to Qatar. Perhaps this will be the beginning of the end to the horror of terrorism!",2017-06-06,2017-06-06,96.64,96.79,96.8,96.52,-0.17
During my recent trip to the Middle East I stated that there can no longer be funding of Radical Ideology. Leaders pointed to Qatar - look!,2017-06-06,2017-06-06,96.64,96.79,96.8,96.52,-0.17
"That's right, we need a TRAVEL BAN for certain DANGEROUS countries, not some politically correct term that won't help us protect our people!",2017-06-06,2017-06-06,96.64,96.79,96.8,96.52,-0.17
Big meeting today with Republican leadership concerning Tax Cuts and Healthcare. We are all pushing hard - must get it right!,2017-06-06,2017-06-06,96.64,96.79,96.8,96.52,-0.17
"RT @foxandfriends: FOX NEWS ALERT: ISIS claims responsibility for hostage siege in Melbourne, Australia that killed 1 person and injured 3...",2017-06-06,2017-06-06,96.64,96.79,96.8,96.52,-0.17
RT @foxandfriends: Sen. Ted Cruz: Trump's air traffic control plan is a 'win-win' for Democrats and Republicans ,2017-06-06,2017-06-06,96.64,96.79,96.8,96.52,-0.17
The FAKE MSM is working so hard trying to get me not to use Social Media. They hate that I can get the honest and unfiltered message out.,2017-06-06,2017-06-06,96.64,96.79,96.8,96.52,-0.17
"Great meeting with @HouseGOP and @SenateGOP leaders, including @SpeakerRyan, @SenateMajLdr, @GOPLeader, @JohnCornyn and @SteveScalise. #USA ",2017-06-07,2017-06-07,96.75,96.54,96.98,96.51,0.11
Senate passed the VA Accountability Act. The House should get this bill to my desk ASAP! We can't tolerate substandard care for our vets.,2017-06-07,2017-06-07,96.75,96.54,96.98,96.51,0.11
"I will be nominating Christopher A. Wray, a man of impeccable credentials, to be the new Director of the FBI. Details to follow.",2017-06-07,2017-06-07,96.75,96.54,96.98,96.51,0.11
"Getting ready to leave for Cincinnati, in the GREAT STATE of OHIO, to meet with ObamaCare victims and talk Healthcare and also Infrastructure!",2017-06-07,2017-06-07,96.75,96.54,96.98,96.51,0.11
A great honor to host and welcome leaders from around America to the @WhiteHouse Infrastructure Summit. #InfrastructureWeek ,2017-06-09,2017-06-09,97.27,97.18,97.5,97.14,0.36
Congratulations to Jeb Hensarling and Republicans on successful House vote to repeal major parts of the 2010 Dodd-Frank financial law. GROWTH!,2017-06-09,2017-06-09,97.27,97.18,97.5,97.14,0.36
"An honor to join the @FaithandFreedom Coalition yesterday. In America, we don't worship government. We worship God. #FaithandFreedom ",2017-06-09,2017-06-09,97.27,97.18,97.5,97.14,0.36
Great reporting by @foxandfriends and so many others. Thank you!,2017-06-09,2017-06-09,97.27,97.18,97.5,97.14,0.36
RT @AlanDersh: We should stop talking about obstruction of justice. No plausible case. We must distinguish crimes from pol sins ,2017-06-09,2017-06-09,97.27,97.18,97.5,97.14,0.36
"Despite so many false statements and lies, total and complete vindication...and WOW, Comey is a leaker!",2017-06-09,2017-06-09,97.27,97.18,97.5,97.14,0.36
"It is time to rebuild OUR country, to bring back OUR jobs, to restore OUR dreams, and yes, to put #AmericaFirst! TY Ohio! #InfrastructureWeek ",2017-06-10,2017-06-12,97.14,97.22,97.32,97.04,-0.13
"Time to start building in our country, with American workers and with American iron, aluminum and steel. It is time to put #AmericaFirst ",2017-06-10,2017-06-12,97.14,97.22,97.32,97.04,-0.13
America is going to build again. Under budget and ahead of schedule. Time to put #AmericaFirst! #InfrastructureWeek ,2017-06-10,2017-06-12,97.14,97.22,97.32,97.04,-0.13
"The #FakeNews MSM doesn't report the great economic news since Election Day. #DOW up 16%. #NASDAQ up 19.5%. Drilling and energy sector way up. Regulations way down. 600,000+ new jobs added. Unemployment down to 4.3%. Business and economic enthusiasm way up- record levels!",2017-06-11,2017-06-12,97.14,97.22,97.32,97.04,-0.13
I believe the James Comey leaks will be far more prevalent than anyone ever thought possible. Totally illegal? Very 'cowardly!',2017-06-11,2017-06-12,97.14,97.22,97.32,97.04,-0.13
"The Democrats have no message, not on economics, not on taxes, not on jobs, not on failing #Obamacare. They are only OBSTRUCTIONISTS!",2017-06-11,2017-06-12,97.14,97.22,97.32,97.04,-0.13
"My daughter, Ivanka, will be on @foxandfriends tomorrow morning. Enjoy!",2017-06-12,2017-06-12,97.14,97.22,97.32,97.04,-0.13
"RT @foxandfriends: ""Yesterday's hearings provided zero evidence of collusion between our campaign and the Russians because there wasn't any...",2017-06-12,2017-06-12,97.14,97.22,97.32,97.04,-0.13
RT @foxandfriends: .@GeraldoRivera: Chances of impeachment went from 3% to 0% with Comey's testimony ,2017-06-12,2017-06-12,97.14,97.22,97.32,97.04,-0.13
"Great numbers on the economy. All of our work, including the passage of many bills and regulation killing Executive Orders, now kicking in!",2017-06-12,2017-06-12,97.14,97.22,97.32,97.04,-0.13
We will NEVER FORGET the victims who lost their lives one year ago today in the horrific #PulseNightClub shooting. #OrlandoUnitedDay ,2017-06-12,2017-06-12,97.14,97.22,97.32,97.04,-0.13
"Finally held our first full @Cabinet meeting today. With this great team, we can restore American prosperity and bring real change to D.C. ",2017-06-12,2017-06-12,97.14,97.22,97.32,97.04,-0.13
"Just arrived in Wisconsin to discuss JOBS, JOBS, JOBS! #MAGA ",2017-06-13,2017-06-13,96.97,97.17,97.28,96.95,-0.18
"2 million more people just dropped out of ObamaCare. It is in a death spiral. Obstructionist Democrats gave up, have no answer = resist!",2017-06-13,2017-06-13,96.97,97.17,97.28,96.95,-0.18
"Heading to the Great State of Wisconsin to talk about JOBS, JOBS, JOBS! Big progress being made as the Real News is reporting.",2017-06-13,2017-06-13,96.97,97.17,97.28,96.95,-0.18
RT @Corrynmb: @realDonaldTrump Liberals have an agenda and it's not in America's best interest. Keep fighting the good fight! We stand with...,2017-06-13,2017-06-13,96.97,97.17,97.28,96.95,-0.18
A.G. Lynch made law enforcement decisions for political purposes...gave Hillary Clinton a free pass and protection. Totally illegal!,2017-06-13,2017-06-13,96.97,97.17,97.28,96.95,-0.18
The Fake News Media has never been so wrong or so dirty. Purposely incorrect stories and phony sources to meet their agenda of hate. Sad!,2017-06-13,2017-06-13,96.97,97.17,97.28,96.95,-0.18
Fake News is at an all time high. Where is their apology to me for all of the incorrect stories???,2017-06-13,2017-06-13,96.97,97.17,97.28,96.95,-0.18
"Well, as predicted, the 9th Circuit did it again - Ruled against the TRAVEL BAN at such a dangerous time in the history of our country. S.C.",2017-06-13,2017-06-13,96.97,97.17,97.28,96.95,-0.18
The passage of the @DeptVetAffairs Accountability and Whistleblower Protection Act is GREAT news for veterans! I look forward to signing it! ,2017-06-14,2017-06-14,96.94,97.0,97.12,96.32,-0.03
