Text,Date_with_affect,Date,Price,Open,High,Low,Change
"Economy growing! Excluding hurricane effects, CEA estimates that real GDP growth would have been 3.9% in Q3.Stock market at a new high, unemployment at a low. We are winning and TAX CUTS will shift our economy into high gear! ",2017-11-29,2017-11-29,93.16,93.22,93.44,92.99,-0.12
Just spoke to President XI JINPING of China concerning the provocative actions of North Korea. Additional major sanctions will be imposed on North Korea today. This situation will be handled!,2017-11-29,2017-11-29,93.16,93.22,93.44,92.99,-0.12
"So now that Matt Lauer is gone when will the Fake News practitioners at NBC be terminating the contract of Phil Griffin? And will they terminate low ratings Joe Scarborough based on the ""unsolved mystery"" that took place in Florida years ago? Investigate!",2017-11-29,2017-11-29,93.16,93.22,93.44,92.99,-0.12
"Wow, Matt Lauer was just fired from NBC for ""inappropriate sexual behavior in the workplace."" But when will the top executives at NBC and Comcast be fired for putting out so much Fake News. Check out Andy Lack's past!",2017-11-29,2017-11-29,93.16,93.22,93.44,92.99,-0.12
Looks like another great day for the Stock Market. Consumer Confidence is at Record High. I guess somebody likes me (my policies)!,2017-11-29,2017-11-29,93.16,93.22,93.44,92.99,-0.12
".@foxandfriends, we are in record territory in all things having to do with our economy! ",2017-11-29,2017-11-29,93.16,93.22,93.44,92.99,-0.12
"Great, and we should boycott Fake News CNN. Dealing with them is a total waste of time! ",2017-11-29,2017-11-29,93.16,93.22,93.44,92.99,-0.12
"Just won the lawsuit on leadership of Consumer Financial Protection Bureau, CFPB. A big win for the Consumer!",2017-11-29,2017-11-29,93.16,93.22,93.44,92.99,-0.12
"Charles McCullough, the respected fmr Intel Comm Inspector General, said public was misled on Crooked Hillary Emails. ""Emails endangered National Security."" Why aren't our deep State authorities looking at this? Rigged and corrupt? @TuckerCarlson @seanhannity",2017-11-29,2017-11-29,93.16,93.22,93.44,92.99,-0.12
"After North Korea missile launch, it's more important than ever to fund our gov't and military! Dems shouldn't hold troop funding hostage for amnesty and illegal immigration. I ran on stopping illegal immigration and won big. They can't now threaten a shutdown to get their demands.",2017-11-29,2017-11-29,93.16,93.22,93.44,92.99,-0.12
"RT @narendramodi: Had a wonderful meeting with @IvankaTrump, advisor to @POTUS and leader of the US delegation at the @GES2017. ",2017-11-29,2017-11-29,93.16,93.22,93.44,92.99,-0.12
"""The Conference Board said that consumer sentiment was at its highest level in nearly 17 years in November. The Consumer Confidence Index rose from 126.2 in October to 129.5, notching its best reading since December 2000..."" ",2017-11-29,2017-11-29,93.16,93.22,93.44,92.99,-0.12
"Dow, SandP 500 and Nasdaq all finished the day at new RECORD HIGHS! ",2017-11-29,2017-11-29,93.16,93.22,93.44,92.99,-0.12
"Remarks from the Roosevelt Room with @SenateMajLdr Mitch McConnell, @SpeakerRyan and Secretary of Defense, General James Mattis. ",2017-11-29,2017-11-29,93.16,93.22,93.44,92.99,-0.12
Great day for Tax Cuts and the Republican Party. But the biggest Winner will be our great Country!,2017-11-29,2017-11-29,93.16,93.22,93.44,92.99,-0.12
The Failing @nytimes has totally gone against the Social Media Guidelines that they installed to preserve some credibility after many of their biased reporters went Rogue! @foxandfriends,2017-11-30,2017-11-30,93.05,93.26,93.5,92.73,-0.12
"The Dow just broke 24,000 for the first time (another all-time Record). If the Dems had won the Presidential Election, the Market would be down 50% from these levels and Consumer Confidence, which is also at an all-time high, would be ""low and glum!""",2017-11-30,2017-11-30,93.05,93.26,93.5,92.73,-0.12
Stock Market hits new Record High. Confidence and enthusiasm abound. More great numbers coming out!,2017-11-30,2017-11-30,93.05,93.26,93.5,92.73,-0.12
"The Chinese Envoy, who just returned from North Korea, seems to have had no impact on Little Rocket Man. Hard to believe his people, and the military, put up with living in such horrible conditions. Russia and China condemned the launch.",2017-11-30,2017-11-30,93.05,93.26,93.5,92.73,-0.12
"The Failing @nytimes, the pipe organ for the Democrat Party, has become a virtual lobbyist for them with regard to our massive Tax Cut Bill. They are wrong so often that now I know we have a winner!",2017-11-30,2017-11-30,93.05,93.26,93.5,92.73,-0.12
"Today, it was my great honor to meet with the Crown Prince of Bahrain at the @WhiteHouse. Bahrain and the United States are important partners.During the Crown Prince's visit, he is advancing $9 BILLION in commercial deals, including finalizing the purchase of F-16's... ",2017-11-30,2017-11-30,93.05,93.26,93.5,92.73,-0.12
The only people who don't like the Tax Cut Bill are the people that don't understand it or the Obstructionist Democrats that know how really good it is and do not want the credit and success to go to the Republicans!,2017-11-30,2017-11-30,93.05,93.26,93.5,92.73,-0.12
The House of Representatives seeks contempt citations(?) against the JusticeDepartment and the FBI for withholding key documents and an FBI witness which could shed light on surveillance of associates of Donald Trump. Big stuff. Deep State. Give this information NOW! @FoxNews,2017-11-30,2017-11-30,93.05,93.26,93.5,92.73,-0.12
".@Theresa_May, don't focus on me, focus on the destructive Radical Islamic Terrorism that is taking place within the United Kingdom. We are doing just fine!",2017-11-30,2017-11-30,93.05,93.26,93.5,92.73,-0.12
"Now, we have a once in a lifetime opportunity to RESTORE AMERICAN PROSPERITY - and RECLAIM AMERICA'S DESTINY.But in order to achieve this bright and glowing future, the SENATE MUST PASS TAX CUTS - and bring Main Street roaring back to life! ",2017-11-30,2017-11-30,93.05,93.26,93.5,92.73,-0.12
"A vote to CUT TAXES is a vote to PUT AMERICA FIRST. It is time to take care of OUR WORKERS, to protect OUR COMMUNITIES, and to REBUILD OUR GREAT COUNTRY! ",2017-11-30,2017-11-30,93.05,93.26,93.5,92.73,-0.12
"This week, the Senate can join the House and take a strong stand for the Middle Class families who are the backbone of America. Together, we will give the American people a big, beautiful Christmas present-a massive tax cut that lets Americans keep more of their HARD-EARNED MONEY! ",2017-11-30,2017-11-30,93.05,93.26,93.5,92.73,-0.12
Funny to hear the Democrats talking about the National Debt when President Obama doubled it in only 8 years!,2017-11-30,2017-11-30,93.05,93.26,93.5,92.73,-0.12
"Economists on the TAX CUTS and JOBS ACT:""The enactment of a comprehensive overhaul - complete with a lower corporate tax rate - will IGNITE our ECONOMY with levels of GROWTH not SEEN IN GENERATIONS..."" ",2017-12-01,2017-12-01,92.89,93.03,93.25,92.6,-0.17
"The media has been speculating that I fired Rex Tillerson or that he would be leaving soon - FAKE NEWS! He's not leaving and while we disagree on certain subjects, (I call the final shots) we work well together and America is highly respected again!",2017-12-01,2017-12-01,92.89,93.03,93.25,92.6,-0.17
RT @WhiteHouse: President Trump proclaims today as #WorldAIDSDay: ,2017-12-01,2017-12-01,92.89,93.03,93.25,92.6,-0.17
Republicans Senators are working hard to pass the biggest Tax Cuts in the history of our Country. The Bill is getting better and better. This is a once in a generation chance. Obstructionist Dems trying to block because they think it is too good and will not be given the credit!,2017-12-01,2017-12-01,92.89,93.03,93.25,92.6,-0.17
A disgraceful verdict in the Kate Steinle case! No wonder the people of our Country are so angry with Illegal Immigration.,2017-12-01,2017-12-01,92.89,93.03,93.25,92.6,-0.17
"The Kate Steinle killer came back and back over the weakly protected Obama border, always committing crimes and being violent, and yet this info was not used in court. His exoneration is a complete travesty of justice. BUILD THE WALL!",2017-12-01,2017-12-01,92.89,93.03,93.25,92.6,-0.17
"The Christmas Story begins 2,000 years ago with a mother, a father, their baby son and the most extraordinary gift of all-the gift of God's love for all of humanity.Whatever our beliefs, we know that the birth of Jesus Christ and the story of his life... ",2017-12-01,2017-12-01,92.89,93.03,93.25,92.6,-0.17
"Today is a day that I've been looking very much forward to ALL YEAR LONG. It is one that you have heard me speak about many times before. Now, as President of the United States, it is my tremendous honor to finally wish America and the world, a very MERRY CHRISTMAS! ",2017-12-01,2017-12-01,92.89,93.03,93.25,92.6,-0.17
The jury was not told the killer of Kate was a 7 time felon. The Schumer/Pelosi Democrats are so weak on Crime that they will pay a big price in the 2018 and 2020 Elections.,2017-12-01,2017-12-01,92.89,93.03,93.25,92.6,-0.17
I had to fire General Flynn because he lied to the Vice President and the FBI. He has pled guilty to those lies. It is a shame because his actions during the transition were lawful. There was nothing to hide!,2017-12-02,2017-12-04,93.19,93.17,93.36,93.07,0.32
"62 years ago this week, a brave seamstress in Montgomery, Alabama uttered one word that changed history... ",2017-12-02,2017-12-04,93.19,93.17,93.36,93.07,0.32
We are one step closer to delivering MASSIVE tax cuts for working families across America. Special thanks to @SenateMajLdr Mitch McConnell and Chairman @SenOrrinHatch for shepherding our bill through the Senate. Look forward to signing a final bill before Christmas! ,2017-12-02,2017-12-04,93.19,93.17,93.36,93.07,0.32
Biggest Tax Bill and Tax Cuts in history just passed in the Senate. Now these great Republicans will be going for final passage. Thank you to House and Senate Republicans for your hard work and commitment!,2017-12-02,2017-12-04,93.19,93.17,93.36,93.07,0.32
"People who lost money when the Stock Market went down 350 points based on the False and Dishonest reporting of Brian Ross of @ABC News (he has been suspended), should consider hiring a lawyer and suing ABC for the damages this bad reporting has caused - many millions of dollars!",2017-12-03,2017-12-04,93.19,93.17,93.36,93.07,0.32
"After years of Comey, with the phony and dishonest Clinton investigation (and more), running the FBI, its reputation is in Tatters - worst in History! But fear not, we will bring it back to greatness.",2017-12-03,2017-12-04,93.19,93.17,93.36,93.07,0.32
"Tainted (no, very dishonest?) FBI ""agent's role in Clinton probe under review."" Led Clinton Email probe. @foxandfriends Clinton money going to wife of another FBI agent in charge.",2017-12-03,2017-12-04,93.19,93.17,93.36,93.07,0.32
"Report: ""ANTI-TRUMP FBI AGENT LED CLINTON EMAIL PROBE"" Now it all starts to make sense!",2017-12-03,2017-12-04,93.19,93.17,93.36,93.07,0.32
I never asked Comey to stop investigating Flynn. Just more Fake News covering another Comey lie!,2017-12-03,2017-12-04,93.19,93.17,93.36,93.07,0.32
"Congratulations to @ABC News for suspending Brian Ross for his horrendously inaccurate and dishonest report on the Russia, Russia, Russia Witch Hunt. More Networks and ""papers"" should do the same with their Fake News!",2017-12-03,2017-12-04,93.19,93.17,93.36,93.07,0.32
"Many people in our Country are asking what the ""Justice"" Department is going to do about the fact that totally Crooked Hillary, AFTER receiving a subpoena from the United States Congress, deleted and ""acid washed"" 33,000 Emails? No justice!",2017-12-03,2017-12-04,93.19,93.17,93.36,93.07,0.32
"So General Flynn lies to the FBI and his life is destroyed, while Crooked Hillary Clinton, on that now famous FBI holiday ""interrogation"" with no swearing in and no recording, lies many times...and nothing happens to her? Rigged system, or just a double standard?",2017-12-03,2017-12-04,93.19,93.17,93.36,93.07,0.32
"RT @PressSec: The Trump effect: ""The U.S. economy is running at its full potential for the first time in a decade"" -WSJ",2017-12-03,2017-12-04,93.19,93.17,93.36,93.07,0.32
"Democrats refusal to give even one vote for massive Tax Cuts is why we need Republican Roy Moore to win in Alabama. We need his vote on stopping crime, illegal immigration, Border Wall, Military, Pro Life, V.A., Judges 2nd Amendment and more. No to Jones, a Pelosi/Schumer Puppet!",2017-12-04,2017-12-04,93.19,93.17,93.36,93.07,0.32
"Putting Pelosi/Schumer Liberal Puppet Jones into office in Alabama would hurt our great Republican Agenda of low on taxes, tough on crime, strong on military and borders...and so much more. Look at your 401-k's since Election. Highest Stock Market EVER! Jobs are roaring back!",2017-12-04,2017-12-04,93.19,93.17,93.36,93.07,0.32
"With the great vote on Cutting Taxes, this could be a big day for the Stock Market - and YOU!",2017-12-04,2017-12-04,93.19,93.17,93.36,93.07,0.32
A must watch: Legal Scholar Alan Dershowitz was just on @foxandfriends talking of what is going on with respect to the greatest Witch Hunt in U.S. political history. Enjoy!,2017-12-04,2017-12-04,93.19,93.17,93.36,93.07,0.32
"Yesterday, I was thrilled to be with so many WONDERFUL friends, in Utah's MAGNIFICENT Capitol.It was my honor to sign two Presidential Proclamations that will modify the national monuments designations of both Bears Ears and Grand Staircase Escalante... ",2017-12-05,2017-12-05,93.38,93.08,93.49,93.03,0.2
"Join me this Friday in Pensacola, Florida at the Pensacola Bay Center! Tickets: ",2017-12-06,2017-12-06,93.61,93.31,93.65,93.17,0.25
"RT @Scavino45: Time lapse video of the border wall prototypes, when they were being built in San Diego.",2017-12-06,2017-12-06,93.61,93.31,93.65,93.17,0.25
I have determined that it is time to officially recognize Jerusalem as the capital of Israel. I am also directing the State Department to begin preparation to move the American Embassy from Tel Aviv to Jerusalem... ,2017-12-06,2017-12-06,93.61,93.31,93.65,93.17,0.25
"Today, the U.S. flag flies at half-staff at the @WhiteHouse, in honor of National Pearl Harbor Remembrance Day. ",2017-12-07,2017-12-07,93.8,93.54,93.8,93.51,0.2
"Across the battlefields, oceans, and harrowing skies of Europe and the Pacific throughout the war, one great battle cry could be heard by America's friends and foes alike:""REMEMBER PEARL HARBOR."" ",2017-12-07,2017-12-07,93.8,93.54,93.8,93.51,0.2
"Today, as we Remember Pearl Harbor, it was an incredible honor to be joined with surviving Veterans of the attack on 12/7/1941. They are HEROES, and they are living witnesses to American History. All American hearts are filled with gratitude for their service and their sacrifice. ",2017-12-07,2017-12-07,93.8,93.54,93.8,93.51,0.2
"National Pearl Harbor Remembrance Day - ""A day that will live in infamy!"" December 7, 1941",2017-12-07,2017-12-07,93.8,93.54,93.8,93.51,0.2
"Today, our entire nation pauses to REMEMBER PEARL HARBOR-and the brave warriors who on that day stood tall and fought for America. God Bless our HEROES who wear the uniform, and God Bless the United States of America. #PearlHarborRemembranceDay ",2017-12-07,2017-12-07,93.8,93.54,93.8,93.51,0.2
"Tonight, @FLOTUS Melania and I were thrilled to welcome so many wonderful friends to the @WhiteHouse - and wish them all a very #HappyHanukkah ",2017-12-08,2017-12-08,93.9,93.79,94.09,93.77,0.11
I fulfilled my campaign promise - others didn't! ,2017-12-08,2017-12-08,93.9,93.79,94.09,93.77,0.11
"Big crowd expected today in Pensacola, Florida, for a Make America Great Again speech. We have done so much in so short a period of time...and yet are planning to do so much more! See you there!",2017-12-08,2017-12-08,93.9,93.79,94.09,93.77,0.11
"LAST thing the Make America Great Again Agenda needs is a Liberal Democrat in Senate where we have so little margin for victory already. The Pelosi/Schumer Puppet Jones would vote against us 100% of the time. He's bad on Crime, Life, Border, Vets, Guns and Military. VOTE ROY MOORE!",2017-12-08,2017-12-08,93.9,93.79,94.09,93.77,0.11
"Fines and penalties against Wells Fargo Bank for their bad acts against their customers and others will not be dropped, as has incorrectly been reported, but will be pursued and, if anything, substantially increased. I will cut Regs but make penalties severe when caught cheating!",2017-12-08,2017-12-08,93.9,93.79,94.09,93.77,0.11
"""The unemployment rate remains at a 17-year low of 4.1%. The unemployment rate in manufacturing dropped to 2.6%, the lowest ever recorded. The unemployment rate among Hispanics dropped to 4.7%, the lowest ever recorded...""@SecretaryAcosta @USDOL ",2017-12-08,2017-12-08,93.9,93.79,94.09,93.77,0.11
"Have a great game today, @USArmy and @USNavy - I will be watching. We love our U.S. Military. On behalf of an entire Nation, THANK YOU for your sacrifice and service! #ArmyNavyGame #USA ",2017-12-09,2017-12-11,93.87,93.93,93.98,93.67,-0.03
"Heading to the great state of Mississippi at the invitation of their popular and respected Governor, @PhilBryantMS. Look forward to seeing the new Civil Rights Museum!",2017-12-09,2017-12-11,93.87,93.93,93.98,93.67,-0.03
"CNN'S slogan is CNN, THE MOST TRUSTED NAME IN NEWS. Everyone knows this is not true, that this could, in fact, be a fraud on the American Public. There are many outlets that are far more trusted than Fake News CNN. Their slogan should be CNN, THE LEAST TRUSTED NAME IN NEWS!",2017-12-09,2017-12-11,93.87,93.93,93.98,93.67,-0.03
"We believe that every American should stand for the National Anthem, and we proudly pledge allegiance to one NATION UNDER GOD! ",2017-12-09,2017-12-11,93.87,93.93,93.98,93.67,-0.03
"A big contingent of very enthusiastic Roy Moore fans at the rally last night. We can't have a Pelosi/Schumer Liberal Democrat, Jones, in that important Alabama Senate seat. Need your vote to Make America Great Again! Jones will always vote against what we must do for our Country.",2017-12-09,2017-12-11,93.87,93.93,93.98,93.67,-0.03
"GREAT EVENING last night in Pensacola, Florida. Arena was packed to the rafters, the crowd was loud, loving and really smart. They definitely get what's going on. Thank you Pensacola!",2017-12-09,2017-12-11,93.87,93.93,93.98,93.67,-0.03
"This is your land, this is your home, and it's your voice that matters the most. So speak up, be heard, and fight, fight, fight for the change you've been waiting for your entire life!MERRY CHRISTMAS and THANK YOU Pensacola, Florida! ",2017-12-09,2017-12-11,93.87,93.93,93.98,93.67,-0.03
"Fake News CNN made a vicious and purposeful mistake yesterday. They were caught red handed, just like lonely Brian Ross at ABC News (who should be immediately fired for his ""mistake""). Watch to see if @CNN fires those responsible, or was it just gross incompetence?",2017-12-09,2017-12-11,93.87,93.93,93.98,93.67,-0.03
"Very little discussion of all the purposely false and defamatory stories put out this week by the Fake News Media. They are out of control - correct reporting means nothing to them. Major lies written, then forced to be withdrawn after they are exposed...a stain on America!",2017-12-10,2017-12-11,93.87,93.93,93.98,93.67,-0.03
"Getting closer and closer on the Tax Cut Bill. Shaping up even better than projected. House and Senate working very hard and smart. End result will be not only important, but SPECIAL!",2017-12-10,2017-12-11,93.87,93.93,93.98,93.67,-0.03
".@DaveWeigel @WashingtonPost put out a phony photo of an empty arena hours before I arrived @ the venue, w/ thousands of people outside, on their way in. Real photos now shown as I spoke. Packed house, many people unable to get in. Demand apology and retraction from FAKE NEWS WaPo! ",2017-12-10,2017-12-11,93.87,93.93,93.98,93.67,-0.03
No American should be separated from their loved ones because of preventable crime committed by those illegally in our country. Our cities should be Sanctuaries for Americans - not for criminal aliens! ,2017-12-10,2017-12-11,93.87,93.93,93.98,93.67,-0.03
".@daveweigel of the Washington Post just admitted that his picture was a FAKE (fraud?) showing an almost empty arena last night for my speech in Pensacola when, in fact, he knew the arena was packed (as shown also on T.V.). FAKE NEWS, he should be fired.",2017-12-10,2017-12-11,93.87,93.93,93.98,93.67,-0.03
"Things are going really well for our economy, a subject the Fake News spends as little time as possible discussing! Stock Market hit another RECORD HIGH, unemployment is now at a 17 year low and companies are coming back into the USA. Really good news, and much more to come!",2017-12-10,2017-12-11,93.87,93.93,93.98,93.67,-0.03
"Another false story, this time in the Failing @nytimes, that I watch 4-8 hours of television a day - Wrong! Also, I seldom, if ever, watch CNN or MSNBC, both of which I consider Fake News. I never watch Don Lemon, who I once called the ""dumbest man on television!"" Bad Reporting.",2017-12-11,2017-12-11,93.87,93.93,93.98,93.67,-0.03
"Despite thousands of hours wasted and many millions of dollars spent, the Democrats have been unable to show any collusion with Russia - so now they are moving on to the false accusations and fabricated stories of women who I don't know and/or have never met. FAKE NEWS!",2017-12-12,2017-12-12,94.1,93.91,94.22,93.76,0.25
"Lightweight Senator Kirsten Gillibrand, a total flunky for Chuck Schumer and someone who would come to my office ""begging"" for campaign contributions not so long ago (and would do anything for them), is now in the ring fighting against Trump. Very disloyal to Bill and Crooked-USED!",2017-12-12,2017-12-12,94.1,93.91,94.22,93.76,0.25
"The people of Alabama will do the right thing. Doug Jones is Pro-Abortion, weak on Crime, Military and Illegal Immigration, Bad for Gun Owners and Veterans and against the WALL. Jones is a Pelosi/Schumer Puppet. Roy Moore will always vote with us. VOTE ROY MOORE!",2017-12-12,2017-12-12,94.1,93.91,94.22,93.76,0.25
"Consumer Confidence is at an All-Time High, along with a Record High Stock Market. Unemployment is at a 17 year low. MAKE AMERICA GREAT AGAIN! Working to pass MASSIVE TAX CUTS (looking good).",2017-12-12,2017-12-12,94.1,93.91,94.22,93.76,0.25
"The reason I originally endorsed Luther Strange (and his numbers went up mightily), is that I said Roy Moore will not be able to win the General Election. I was right! Roy worked hard but the deck was stacked against him!",2017-12-13,2017-12-13,93.43,94.06,94.11,93.39,-0.71
"Wow, more than 90% of Fake News Media coverage of me is negative, with numerous forced retractions of untrue stories. Hence my use of Social Media, the only way to get the truth out. Much of Mainstream Meadia has become a joke! @foxandfriends",2017-12-13,2017-12-13,93.43,94.06,94.11,93.39,-0.71
"If last night's election proved anything, it proved that we need to put up GREAT Republican candidates to increase the razor thin margins in both the House and Senate.",2017-12-13,2017-12-13,93.43,94.06,94.11,93.39,-0.71
"In 1960, there were approximately 20,000 pages in the Code of Federal Regulations. Today there are over 185,000 pages, as seen in the Roosevelt Room.Today, we CUT THE RED TAPE! It is time to SET FREE OUR DREAMS and MAKE AMERICA GREAT AGAIN! ",2017-12-14,2017-12-14,93.49,93.41,93.76,93.28,0.06
"When Americans are free to thrive, innovate, and prosper, there is no challenge too great, no task too large, and no goal beyond our reach. We are a nation of explorers, pioneers, innovators and inventors. We are nation of people who work hard, dream big, and who never, ever give up... ",2017-12-14,2017-12-14,93.49,93.41,93.76,93.28,0.06
"""Manufacturing Optimism Rose to Another All-Time High in the Latest @ShopFloorNAM Outlook Survey"" ",2017-12-14,2017-12-14,93.49,93.41,93.76,93.28,0.06
"As a candidate, I promised we would pass a massive tax cut for the everyday, working Americans. If you make your voices heard, this moment will be forever remembered as a great new beginning - the dawn of a brilliant American future shining with PATRIOTISM, PROSPERITY AND PRIDE! ",2017-12-14,2017-12-14,93.49,93.41,93.76,93.28,0.06
"Republican Tax Cuts are looking very good. All are working hard. In the meantime, the Stock Market hit another record high!",2017-12-14,2017-12-14,93.49,93.41,93.76,93.28,0.06
"Today, we gathered in the Roosevelt Room for one single reason: to CUT THE RED TAPE! For many decades, an ever-growing maze of regs, rules, and restrictions has cost our country trillions of dollars, millions of jobs, countless American factories, and devastated entire industries. ",2017-12-14,2017-12-14,93.49,93.41,93.76,93.28,0.06
RT @GOPChairwoman: .@realDonaldTrump is the Paycheck President. Learn how the tax bill will put more money in your pocket and how to contact...,2017-12-15,2017-12-15,93.93,93.65,94.0,93.41,0.47
"DOW, SandP 500 and NASDAQ close at record highs! #MAGA ",2017-12-16,2017-12-18,93.69,93.98,94.03,93.38,-0.26
RT @PressSec: .@POTUS historic tax cuts + doubling of the child tax credit will do infinitely more to empower working moms than liberals' p...,2017-12-16,2017-12-18,93.69,93.98,94.03,93.38,-0.26
"RT @SpeakerRyan: For individuals and families, the final Tax Cuts and Jobs Act: lowers individual taxes nearly doubles the standard deducti...",2017-12-16,2017-12-18,93.69,93.98,94.03,93.38,-0.26
"RT @RepKristiNoem: A lot of tough decisions got us to this point, but we're closer than we've been in 30+ years to a fairer tax code that k...",2017-12-16,2017-12-18,93.69,93.98,94.03,93.38,-0.26
"TAX CUTS will increase investment in the American economy and in U.S. workers, leading to higher growth, higher wages, and more JOBS! ",2017-12-16,2017-12-18,93.69,93.98,94.03,93.38,-0.26
