Id,Text,Date,Open,Market_change
942717030091943936,"Remember, Republicans are 5-0 in Congressional Races this year. The media refuses to mention this. I said Gillespie and Moore would lose (for very different reasons), and they did. I also predicted ""I"" would win. Republicans will do well in 2018, very well! @foxandfriends",2017-12-18,48082.82,1.15
942827072824672262,"The train accident that just occurred in DuPont, WA shows more than ever why our soon to be submitted infrastructure plan must be approved quickly. Seven trillion dollars spent in the Middle East while our roads, bridges, tunnels, railways (and more) crumble! Not for long!",2017-12-18,48082.82,1.15
942840800853024770,Our deepest sympathies and most heartfelt prayers are with the victims of the train derailment in Washington State. We are closely monitoring the situation and coordinating with local authorities... ,2017-12-18,48082.82,1.15
942851788461563906,"Over the past 11 months, I have travelled tens of thousands of miles, to visit 13 countries. I have met with more than 100 world leaders and everywhere I traveled, it was my highest privilege and greatest honor to represent the AMERICAN PEOPLE! ",2017-12-18,48082.82,1.15
942854056162332677,"When the American People speak, ALL OF US should listen. Just over one year ago, you spoke loud and clear. On November 8, 2016, you voted to MAKE AMERICA GREAT AGAIN! ",2017-12-18,48082.82,1.15
942857031693799425,"As the world watches, we are days away from passing HISTORIC TAX CUTS for American families and businesses. It will be the BIGGEST TAX CUT and TAX REFORM in the HISTORY of our country! ",2017-12-18,48082.82,1.15
943079382163353600,"Stocks and the economy have a long way to go after the Tax Cut Bill is totally understood and appreciated in scope and size. Immediate expensing will have a big impact. Biggest Tax Cuts and Reform EVER passed. Enjoy, and create many beautiful JOBS!",2017-12-19,48636.52,-0.48
943135588496093190,"A story in the @washingtonpost that I was close to ""rescinding"" the nomination of Justice Gorsuch prior to confirmation is FAKE NEWS. I never even wavered and am very proud of him and the job he is doing as a Justice of the U.S. Supreme Court. The unnamed sources don't exist!",2017-12-19,48636.52,-0.48
943362605258813441,"The United States Senate just passed the biggest in history Tax Cut and Reform Bill. Terrible Individual Mandate (ObamaCare)Repealed. Goes to the House tomorrow morning for final vote. If approved, there will be a News Conference at The White House at approximately 1:00 P.M.",2017-12-20,48449.24,-0.03
943489378462130176,"The Tax Cuts are so large and so meaningful, and yet the Fake News is working overtime to follow the lead of their friends, the defeated Dems, and only demean. This is truly a case where the results will speak for themselves, starting very soon. Jobs, Jobs, Jobs!",2017-12-20,48449.24,-0.03
943521141062238208,I would like to congratulate @SenateMajLdr on having done a fantastic job both strategically and politically on the passing in the Senate of the MASSIVE TAX CUT and Reform Bill. I could have not asked for a better or more talented partner. Our team will go onto many more VICTORIES!,2017-12-20,48449.24,-0.03
943819430735372289,"The Massive Tax Cuts, which the Fake News Media is desperate to write badly about so as to please their Democrat bosses, will soon be kicking in and will speak for themselves. Companies are already making big payments to workers. Dems want to raise taxes, hate these big Cuts!",2017-12-21,48418.09,0.23
943824695144697857,Was @foxandfriends just named the most influential show in news? You deserve it - three great people! The many Fake News Hate Shows should study your formula for success!,2017-12-21,48418.09,0.23
943856675294982145,"House Democrats want a SHUTDOWN for the holidays in order to distract from the very popular, just passed, Tax Cuts. House Republicans, don't let this happen. Pass the C.R. TODAY and keep our Government OPEN!",2017-12-21,48418.09,0.23
943908041803657216,"THANK YOU to everyone who joined me at the @WhiteHouse yesterday. Together, we are MAKING AMERICA GREAT AGAIN! ",2017-12-21,48418.09,0.23
944308491887316992,"Today, it was my great honor to sign the largest TAX CUTS and reform in the history of our country. Full remarks: ",2017-12-22,48429.97,-0.24
944308373373308929,"The United Nations Security Council just voted 15-0 in favor of additional Sanctions on North Korea. The World wants Peace, not Death!",2017-12-22,48429.97,-0.24
944222157218942978,"With all my Administration has done on Legislative Approvals (broke Harry Truman's Record), Regulation Cutting, Judicial Appointments, Building Military, VA, TAX CUTS and REFORM, Record Economy/Stock Market and so much more, I am sure great credit will be given by mainstream news?",2017-12-22,48429.97,-0.24
944210183089254400,"""The President has accomplished some absolutely historic things during this past year."" Thank you Charlie Kirk of Turning Points USA. Sadly, the Fake Mainstream Media will NEVER talk about our accomplishments in their end of year reviews. We are compiling a long and beautiful list.",2017-12-22,48429.97,-0.24
944192071535153152,"At some point, and for the good of the country, I predict we will start working with the Democrats in a Bipartisan fashion. Infrastructure would be a perfect place to start. After having foolishly spent $7 trillion in the Middle East, it is time to start rebuilding our country!",2017-12-22,48429.97,-0.24
944187730564714497,"Our big and very popular Tax Cut and Reform Bill has taken on an unexpected new source of ""love"" - that is big companies and corporations showering their workers with bonuses. This is a phenomenon that nobody even thought of, and now it is the rage. Merry Christmas!",2017-12-22,48429.97,-0.24
944222979147337728,Will be signing the biggest ever Tax Cut and Reform Bill in 30 minutes in Oval Office. Will also be signing a much needed 4 billion dollar missile defense bill.,2017-12-22,48429.97,-0.24
944329684032081921,"Remember, the most hated part of ObamaCare is the Individual Mandate, which is being terminated under our just signed Tax Cut Bill.",2017-12-26,48473.31,0.13
944665687292817415,"How can FBI Deputy Director Andrew McCabe, the man in charge, along with leakin' James Comey, of the Phony Hillary Clinton investigation (including her 33,000 illegally deleted emails) be given $700,000 for wife's campaign by Clinton Puppets during investigation?",2017-12-26,48473.31,0.13
945030174290186241,"The Tax Cut/Reform Bill, including Massive Alaska Drilling and the Repeal of the highly unpopular Individual Mandate, brought it all together as to what an incredible year we had. Don't let the Fake News convince you otherwise...and our insider Polls are strong!",2017-12-26,48473.31,0.13
944906847970119680,".@FoxNews-FBI's Andrew McCabe, ""in addition to his wife getting all of this money from M (Clinton Puppet), he was using, allegedly, his FBI Official Email Account to promote her campaign. You obviously cannot do this. These were the people who were investigating Hillary Clinton.""",2017-12-26,48473.31,0.13
944703626454487042,"Remember, the Republicans are 5-0 in Congressional races this year. In Senate, I said Roy M would lose in Alabama and supported Big Luther Strange - and Roy lost. Virginia candidate was not a ""Trumper,"" and he lost. Good Republican candidates will win BIG!",2017-12-26,48473.31,0.13
945624910898122752,"Based on the fact that the very unfair and unpopular Individual Mandate has been terminated as part of our Tax Cut Bill, which essentially Repeals (over time) ObamaCare, the Democrats and Republicans will eventually come together and develop a great new HealthCare plan!",2017-12-26,48473.31,0.13
945646491955290113,"WOW, @foxandfrlends ""Dossier is bogus. Clinton Campaign, DNC funded Dossier. FBI CANNOT (after all of this time) VERIFY CLAIMS IN DOSSIER OF RUSSIA/TRUMP COLLUSION. FBI TAINTED."" And they used this Crooked Hillary pile of garbage as the basis for going after the Trump Campaign!",2017-12-26,48473.31,0.13
946728546633953285,"Why is the United States Post Office, which is losing many billions of dollars a year, while charging Amazon and others so little to deliver their packages, making Amazon richer and the Post Office dumber and poorer? Should be charging MUCH MORE!",2017-12-29,48880.39,1.01
947180713236934657,"The entire world understands that the good people of Iran want change, and, other than the vast military power of the United States, that Iran's people are what their leaders fear the most.... ",2018-01-02,49376.26,1.38
947181212468203520,"Oppressive regimes cannot endure forever, and the day will come when the Iranian people will face a choice. The world is watching! ",2018-01-02,49376.26,1.38
947544600918372353,"What a year it's been, and we're just getting started. Together, we are MAKING AMERICA GREAT AGAIN! Happy New Year!! ",2018-01-02,49376.26,1.38
947458942719979520,"If the Dems (Crooked Hillary) got elected, your stocks would be down 50% from values on Election Day. Now they have a great future - and just beginning! ",2018-01-02,49376.26,1.38
947614110082043904,"HAPPY NEW YEAR! We are MAKING AMERICA GREAT AGAIN, and much faster than anyone thought possible!",2018-01-02,49376.26,1.38
947802588174577664,"The United States has foolishly given Pakistan more than 33 billion dollars in aid over the last 15 years, and they have given us nothing but lies and deceit, thinking of our leaders as fools. They give safe haven to the terrorists we hunt in Afghanistan, with little help. No more!",2018-01-02,49376.26,1.38
948255367393349634,We will not rest until all of America's GREAT VETERANS can receive the care they so richly deserve. Tremendous progress has been made in a short period of time. Keep up the great work @SecShulkin @DeptVetAffairs! ,2018-01-02,49376.26,1.38
948211438472089600,"Democrats are doing nothing for DACA - just interested in politics. DACA activists and Hispanics will go hard against Dems, will start ""falling in love"" with Republicans and their President! We are about RESULTS.",2018-01-02,49376.26,1.38
948195478428102657,"Since taking office I have been very strict on Commercial Aviation. Good news - it was just reported that there were Zero deaths in 2017, the best and safest year on record! .impartial journalists of a much higher standard, lose all of your phony and non-existent ""sources,"" and treat the President of the United States FAIRLY, so that the next time I (and the people) win, you won't have to write an apology to your readers for a job poorly done! GL",2018-01-02,49376.26,1.38
948174033882927104,"Crooked Hillary Clinton's top aid, Huma Abedin, has been accused of disregarding basic security protocols. She put Classified Passwords into the hands of foreign agents. Remember sailors pictures on submarine? Jail! Deep State Justice Dept must finally act? Also on Comey and others",2018-01-02,49376.26,1.38
948189482284707840,Companies are giving big bonuses to their workers because of the Tax Cut Bill. Really great!,2018-01-02,49376.26,1.38
948322496591384576,"It's not only Pakistan that we pay billions of dollars to for nothing, but also many other countries, and others. As an example, we pay the Palestinians HUNDRED OF MILLIONS OF DOLLARS a year and get no appreciation or respect. They don't even want to negotiate a long overdue peace treaty with Israel. We have taken Jerusalem, the toughest part of the negotiation, off the table, but Israel, for that, would have had to pay more. But with the Palestinians no longer willing to talk peace, why should we make any of these massive future payments to them?",2018-01-03,50093.31,-0.5
948548807612084224,Such respect for the people of Iran as they try to take back their corrupt government. You will see great support from the United States at the appropriate time!,2018-01-03,50093.31,-0.5
948879774277128197,"With all of the failed ""experts"" weighing in, does anybody really believe that talks and dialogue would be going on between North and South Korea right now if I wasn't firm, strong and willing to commit our total ""might"" against the North. Fools, but talks are a good thing!",2018-01-04,49800.36,-0.08
948722170531893248,"Melania and I are deeply saddened by the death of Thomas S. Monson, a beloved President of the Church of Jesus Christ of Latter-day Saints ""Some 40 U.S. companies have responded to President Trump's tax cut and reform victory in Congress last year by handing out bonuses up to $2,000, increases in 401k matches and spending on charity, a much higher number than previously known."" ",2018-01-04,49800.36,-0.08
948872192284155904,"Many mostly Democrat States refused to hand over data from the 2016 Election to the Commission On Voter Fraud. They fought hard that the Commission not see their records or methods because they know that many people are voting illegally. System is rigged, must go to Voter I.D.",2018-01-04,49800.36,-0.08
948738634722742273,"Stock Market had another good day but, now that the Tax Cut Bill has passed, we have tremendous upward potential. Dow just short of 25,000, a number that few thought would be possible this soon into my administration. Also, unemployment went down to 4.1%. Only getting better!",2018-01-04,49800.36,-0.08
948874586006925313,"As Americans, you need identification, sometimes in a very strong and accurate form, for almost everything you do except when it comes to the most important thing, VOTING for the people that run your country. Push hard for Voter Identification!",2018-01-04,49800.36,-0.08
949287555660500992,"Well, now that collusion with Russia is proving to be a total hoax and the only collusion is with Hillary Clinton and the FBI/Russia, the Fake News Media (Mainstream) and this phony new book are hitting out at every new front imaginable. They should try winning an election. Sad!",2018-01-05,49929.52,0.29
949126530839572481,"I authorized Zero access to White House (actually turned him down many times) for author of phony book! I never spoke to him for book. Full of lies, misrepresentations and sources that don't exist. Look at this guy's past and watch what happens to him and Sloppy Steve!",2018-01-05,49929.52,0.29
949066181381632001,"Thank you to the great Republican Senators who showed up to our mtg on immigration reform. We must BUILD THE WALL, stop illegal immigration, end chain migration and cancel the visa lottery. The current system is unsafe and unfair to the great people of our country - time for change!",2018-01-05,49929.52,0.29
949616329463615489,"Now that Russian collusion, after one year of intense study, has proven to be a total hoax on the American public, the Democrats and their lapdogs, the Fake News Mainstream Media, are taking out the old Ronald Reagan playbook and screaming mental stability and intelligence .Actually, throughout my life, my two greatest assets have been mental stability and being, like, really smart. Crooked Hillary Clinton also played these cards very hard and, as everyone knows, went down in flames. I went from VERY successful businessman, to top T.V. Star .to President of the United States (on my first try). I think that would qualify as not smart, but genius....and a very stable genius at that!",2018-01-08,49916.57,0.22
950012437788585985,"Leaving Camp David for the White House. Great meetings with the Cabinet and Military on many very important subjects including Border Security and the desperately needed Wall, the ever increasing Drug and Opioid Problem, Infrastructure, Military, Budget, Trade and DACA.",2018-01-08,49916.57,0.22
950023175907266560,Jake Tapper of Fake News CNN just got destroyed in his interview with Stephen Miller of the Trump Administration. Watch the hatred and unfairness of this CNN flunky!,2018-01-08,49916.57,0.22
950103659337134080,"The Fake News Awards, those going to the most corrupt and biased of the Mainstream Media, will be presented to the losers on Wednesday, January 17th, rather than this coming Monday. The interest in, and importance of, these awards is far greater than anyone could have anticipated!",2018-01-08,49916.57,0.22
950105312782114817,"The Stock Market has been creating tremendous benefits for our country in the form of not only Record Setting Stock Prices, but present and future Jobs, Jobs, Jobs. Seven TRILLION dollars of value created since our big election win!",2018-01-08,49916.57,0.22
950206338411499520,"""His is turning out to be an enormously consequential presidency. So much so that, despite my own frustration over his missteps, there has never been a day when I wished Hillary Clinton were president. Not one. Indeed, as Trump's accomplishments accumulate, the mere thought of Clinton in the WH, doubling down on Barack Obama's failed policies, washes away any doubts that America made the right choice. This was truly a change election - and the changes Trump is bringing are far-reaching and necessary."" Thank you Michael Goodwin! ",2018-01-08,49916.57,0.22
950507353094356993,"We are fighting for our farmers, for our country, and for our GREAT AMERICAN FLAG. We want our flag respected - and we want our NATIONAL ANTHEM respected also! ",2018-01-09,50002.03,-0.59
950777029816963072,"On behalf of the American people, THANK YOU to our incredible law enforcement officers. As President of the United States - I will fight for you, and I will never, ever let you down. Now, more than ever, we must support the men and women in blue! #LawEnforcementAppreciationDay ",2018-01-09,50002.03,-0.59
951184020150382592,"I want to thank my @Cabinet for working tirelessly on behalf of our country. 2017 was a year of monumental achievement and we look forward to the year ahead. Together, we are delivering results and MAKING AMERICA GREAT AGAIN! ",2018-01-10,49666.23,-1.84
951109942685126656,"The single greatest Witch Hunt in American history continues. There was no collusion, everybody including the Dems knows there was no collusion, and yet on and on it goes. Russia and the world is laughing at the stupidity they are witnessing. Republicans should finally take control!",2018-01-10,49666.23,-1.84
951094078661414912,It just shows everyone how broken and unfair our Court System is when the opposing side in a case (such as DACA) always runs to the 9th Circuit and almost always wins before being reversed by higher courts.,2018-01-10,49666.23,-1.84
951204878562549767,"Today, it was my great honor to welcome Prime Minister Erna Solberg of Norway to the @WhiteHouse - a great friend and ally of the United States! Joint press conference: ",2018-01-10,49666.23,-1.84
950937350003183618,"Thank you @GOPLeader Kevin McCarthy! Couldn't agree w/you more. TOGETHER, we are #MAGA ",2018-01-10,49666.23,-1.84
950866561153331202,"Today, it was my great honor to sign a new Executive Order to ensure Veterans have the resources they need as they transition back to civilian life. We must ensure that our HEROES are given the care and support they so richly deserve! ",2018-01-10,49666.23,-1.84
950862709599465472,"Thanks to all of the Republican and Democratic lawmakers for today's very productive meeting on immigration reform. There was strong agreement to negotiate a bill that deals with border security, chain migration, lottery and DACA. ",2018-01-10,49666.23,-1.84
951431836030459905,"""House votes on controversial FISA ACT today."" This is the act that may have been used, with the help of the discredited and phony Dossier, to so badly surveil and abuse the Trump Campaign by the previous administration and others?",2018-01-11,48840.16,0.03
951416674808467461,"Disproven and paid for by Democrats ""Dossier used to spy on Trump Campaign. Did FBI use Intel tool to influence the Election?"" @foxandfriends Did Dems or Clinton also pay Russians? Where are hidden and smashed DNC servers? Where are Crooked Hillary Emails? What a mess!",2018-01-11,48840.16,0.03
951236634095308800,"Cutting taxes and simplifying regulations makes America the place to invest! Great news as Toyota and Mazda announce they are bringing 4,000 JOBS and investing $1.6 BILLION in Alabama, helping to further grow our economy! ",2018-01-11,48840.16,0.03
951229113897013248,"The United States needs the security of the Wall on the Southern Border, which must be part of any DACA approval. The safety and security of our country is #1! ",2018-01-11,48840.16,0.03
951798415301718017,"Sadly, Democrats want to stop paying our troops and government workers in order to give a sweetheart deal, not a fair deal, for DACA. Take care of our Military, and our Country, FIRST!",2018-01-12,48764.91,0.69
951785587765280768,"The so-called bipartisan DACA deal presented yesterday to myself and a group of Republican Senators and Congressmen was a big step backwards. Wall was not properly funded, Chain and Lottery were made worse and USA would be forced to take large numbers of people from high crime .countries which are doing badly. I want a merit based system of immigration and people who will help take our country to the next level. I want safety and security for our people. I want to stop the massive inflow of drugs. I want to fund our military, not do a Dem defund .Because of the Democrats not being interested in life and safety, DACA has now taken a big step backwards. The Dems will threaten ""shutdown,"" but what they are really doing is shutting down our military, at a time we need it most. Get smart, MAKE AMERICA GREAT AGAIN!",2018-01-12,48764.91,0.69
951675713089888256,"The Democrats seem intent on having people and drugs pour into our country from the Southern Border, risking thousands of lives in the process. It is my duty to protect the lives and safety of all Americans. We must build a Great Wall, think Merit and end Lottery and Chain. USA!",2018-01-12,48764.91,0.69
951647402599026689,"More great news as a result of historical Tax Cuts and Reform: Fiat Chrysler announces plan to invest more than $1 BILLION in Michigan plant, relocating their heavy-truck production from Mexico to Michigan, adding 2,500 new jobs and paying $2,000 bonus to U.S. employees! ",2018-01-12,48764.91,0.69
951596346011680768,"Yesterday, I signed the #INTERDICTAct (H.R. 2142) with bipartisan members of Congress to help end the flow of drugs into our country. Together, we are committed to doing everything we can to combat the deadly scourge of drug addiction and overdose in the United States! ",2018-01-12,48764.91,0.69
951679619341737986,"Reason I canceled my trip to London is that I am not a big fan of the Obama Administration having sold perhaps the best located and finest embassy in London for ""peanuts,"" only to build a new one in an off location for 1.2 billion dollars. Bad deal. Wanted me to cut ribbon-NO!",2018-01-12,48764.91,0.69
952166857670320128,The Democrats are all talk and no action. They are doing nothing to fix DACA. Great opportunity missed. Too bad!,2018-01-15,49183.59,0.47
952183458922672130,"I don't believe the Democrats really want to see a deal on DACA. They are all talk and no action. This is the time but, day by day, they are blowing the one great opportunity they have. Too bad!",2018-01-15,49183.59,0.47
952530515894169601,"I, as President, want people coming into our Country who are going to help us become strong and great again, people coming in through a system based on MERIT. No more Lotteries! #AMERICA FIRST",2018-01-15,49183.59,0.47
952528011869478912,"DACA is probably dead because the Democrats don't really want it, they just want to talk and take desperately needed money away from our Military.",2018-01-15,49183.59,0.47
952538350333939713,"""President Trump is not getting the credit he deserves for the economy. Tax Cut bonuses to more than 2,000,000 workers. Most explosive Stock Market rally that we've seen in modern times. 18,000 to 26,000 from Election, and grounded in profitability and growth. All Trump, not 0 big unnecessary regulation cuts made it all possible"" (among many other things). ""President Trump reversed the policies of President Obama, and reversed our economic decline."" Thank you Stuart Varney. @foxandfriends",2018-01-15,49183.59,0.47
953267506004754432,"The Democrats want to shut down the Government over Amnesty for all and Border Security. The biggest loser will be our rapidly rebuilding Military, at a time we need it more than ever. We need a merit based system of immigration, and we need it now! No more dangerous Lottery.",2018-01-16,49292.38,0.25
953270558573154305,"Do you notice the Fake News Mainstream Media never likes covering the great and record setting economic news, but rather talks about anything negative or that can be turned into the negative. The Russian Collusion Hoax is dead, except as it pertains to the Dems. Public gets it!",2018-01-16,49292.38,0.25
953406423177859073,"New report from DOJ and DHS shows that nearly 3 in 4 individuals convicted of terrorism-related charges are foreign-born. We have submitted to Congress a list of resources and reforms .we need to keep America safe, including moving away from a random chain migration and lottery system, to one that is merit-based. ",2018-01-17,49499.23,0.48
953987636057821184,A government shutdown will be devastating to our military...something the Dems care very little about!,2018-01-18,49681.18,0.36
954097213608570880,"AMERICA will once again be a NATION that thinks big, dreams bigger, and always reaches for the stars. YOU are the ones who will shape America's destiny. YOU are the ones who will restore our prosperity. And YOU are the ones who are MAKING AMERICA GREAT AGAIN! #MAGA ",2018-01-18,49681.18,0.36
954092417250222082,"Departing Pittsburgh now, where it was my great honor to stand with our incredible workers, and to show the world that AMERICA is back - and we are coming back bigger and better and stronger than ever before! ",2018-01-18,49681.18,0.36
