Id,Text,Date,Open,Market_change
908161523180285953,"The ""deplorables"" came back to haunt Hillary.They expressed their feelings loud and clear. She spent big money but, in the end, had no game!",2017-09-14,50094.9,-0.11
908160218995068928,Crooked Hillary Clinton blames everybody (and every thing) but herself for her election loss. She lost the debates and lost her direction!,2017-09-14,50094.9,-0.11
908274366739345409,"The WALL, which is already under construction in the form of new renovation of old and existing fences and walls, will continue to be built.",2017-09-14,50094.9,-0.11
908796281002307584,"Our hearts and prayers go out to the people of London, who suffered a vicious terrorist attack.... ",2017-09-15,50058.62,-0.37
908768057140629506,NEVER forget our HEROES held prisoner or who have gone missing in action while serving their country.Proclamation: ,2017-09-15,50058.62,-0.37
908642277987356673,Another attack in London by a loser terrorist.These are sick and demented people who were in the sights of Scotland Yard. Must be proactive!,2017-09-15,50058.62,-0.37
908640949605163010,"With the ridiculous Filibuster Rule in the Senate, Republicans need 60 votes to pass legislation, rather than 51. Can't get votes, END NOW!",2017-09-15,50058.62,-0.37
908494344008749056,"FLORIDA-Just like TX, WE are w/you today, we are w/you tomorrow, and we will be w/you EVERY SINGLE DAY AFTER, to RESTORE, RECOVER, and REBUILD! ",2017-09-15,50058.62,-0.37
908645126146265090,"The travel ban into the United States should be far larger, tougher and more specific-but stupidly, that would not be politically correct!",2017-09-15,50058.62,-0.37
909384837018112000,I spoke with President Moon of South Korea last night. Asked him how Rocket Man is doing. Long gas lines forming in North Korea. Too bad!,2017-09-18,49953.14,0.67
909185223887347712,"A great deal of good things happening for our country. Jobs and Stock Market at all time highs, and I believe will be getting even better!",2017-09-18,49953.14,0.67
909922763774861314,"Such an honor to have my good friend, Israel PM @Netanyahu, join us w/ his delegation in NYC this afternoon. #UNGA ",2017-09-19,50327.32,0.01
909975689838731264,It was a great honor to be with President @EmmanuelMacron of France this afternoon with his delegation. Great bilateral meeting! #UNGA ,2017-09-19,50327.32,0.01
910101538336583680,"Big day at the United Nations - many good things, and some tricky ones, happening. We have a great team. Big speech at 10:00 A.M.",2017-09-19,50327.32,0.01
910192375267561472,"Thehas great strength and patience, but if it is forced to defend itself or its allies, we will have no choice but to totally destroy #NorthKorea. ",2017-09-19,50327.32,0.01
910551350408241152,"Honored to meet w/ Pres Abbas from the Palestinian Authority and his delegation, who have been working hard w/everybody involved toward peace. ",2017-09-20,50312.79,0.2
910524897515905025,It was a great honor to be with King Abdullah II of Jordan and his delegation this morning. We had a GREAT bilateral meeting! ,2017-09-20,50312.79,0.2
910477734635286528,I hope Republican Senators will vote for Graham-Cassidy and fulfill their promise to Repeal and Replace ObamaCare. Money direct to States!,2017-09-20,50312.79,0.2
910443493511827456,The Iran deal was one of the worst and most one sided transactions the United States has EVER entered into.,2017-09-20,50312.79,0.2
910453612630900736,"After allowing North Korea to research and build Nukes while Secretary of State (Bill C also), Crooked Hillary now criticizes.",2017-09-20,50312.79,0.2
910447064944955392,Big meetings today at the United Nations. So many interesting leaders. America First will MAKE AMERICA GREAT AGAIN!,2017-09-20,50312.79,0.2
910330501411590146,A great and important day at the United Nations.Met with leaders of many nations who agree with much (or all) of what I stated in my speech!,2017-09-20,50312.79,0.2
910328626075389952,"Puerto Rico being hit hard by new monster Hurricane. Be careful, our hearts are with you- will be there to help!",2017-09-20,50312.79,0.2
910926223684931585,"Today, I announced a new Executive Order with re: to North Korea. We must all do our part to ensure the complete denuclearization of #NoKo. ",2017-09-21,50385.34,0.36
910641701064204288,I would not sign Graham-Cassidy if it did not include coverage of preexisting conditions. It does! A great Bill. Repeal and Replace.,2017-09-21,50385.34,0.36
911189860769255424,"The greatest influence over our election was the Fake News Media ""screaming"" for Crooked Hillary Clinton. Next, she was a bad candidate!",2017-09-22,50487.93,-0.46
910992971620864004,Senator Luther Strange has gone up a lot in the polls since I endorsed him a month ago. Now a close runoff. He will be great in D.C.,2017-09-22,50487.93,-0.46
911173124976193536,"Rand Paul, or whoever votes against Hcare Bill, will forever (future political campaigns) be known as ""the Republican who saved ObamaCare.""",2017-09-22,50487.93,-0.46
911179462745710593,"The Russia hoax continues, now it's ads on Facebook. What about the totally biased and dishonest Media coverage in favor of Crooked Hillary?",2017-09-22,50487.93,-0.46
911541328013676544,"John McCain never had any intention of voting for this Bill, which his Governor loves. He campaigned on Repeal and Replace. Let Arizona down!",2017-09-25,50302.13,0.11
911543222731706368,"Arizona had a 116% increase in ObamaCare premiums last year, with deductibles very high. Chuck Schumer sold John McCain a bill of goods. Sad",2017-09-25,50302.13,0.11
911545480651378689,Large Block Grants to States is a good thing to do. Better control and management. Great for Arizona. McCain let his best friend L.G. down!,2017-09-25,50302.13,0.11
911549099752804357,"Alaska had a 200% plus increase in premiums under ObamaCare, worst in the country. Deductibles high, people angry! Lisa M comes through.",2017-09-25,50302.13,0.11
911572182060453893,"Going to the White House is considered a great honor for a championship team.Stephen Curry is hesitating,therefore invitation is withdrawn!",2017-09-25,50302.13,0.11
911654184918880260,"If a player wants the privilege of making millions of dollars in the NFL,or other leagues, he or she should not be allowed to disrespect our Great American Flag (or Country) and should stand for the National Anthem. If not, YOU'RE FIRED. Find something else to do!",2017-09-25,50302.13,0.11
911700914997792769,Very proud of our incredible First Lady (@FLOTUS.) She is a truly great representative for our country! ,2017-09-25,50302.13,0.11
911711539815702529,Iran just test-fired a Ballistic Missile capable of reaching Israel.They are also working with North Korea.Not much of an agreement we have!,2017-09-25,50302.13,0.11
912037003923005440,Courageous Patriots have fought and died for our great American Flag --- we MUST honor and respect it! MAKE AMERICA GREAT AGAIN!,2017-09-25,50302.13,0.11
912019957243883520,Please to inform that the Champion Pittsburgh Penguins of the NHL will be joining me at the White House for Ceremony. Great team!,2017-09-25,50302.13,0.11
911789314169823232,"Just heard Foreign Minister of North Korea speak at U.N. If he echoes thoughts of Little Rocket Man, they won't be around much longer!",2017-09-25,50302.13,0.11
911718138747727872,Roger Goodell of NFL just put out a statement trying to justify the total disrespect certain players show to our country.Tell them to stand!,2017-09-25,50302.13,0.11
911904261553950720,"If NFL fans refuse to go to games until players stop disrespecting our Flag and Country, you will see change take place fast. Fire or suspend! NFL attendance and ratings are WAY DOWN. Boring games yes, but many stay away because they love our country. League should back U.S.",2017-09-25,50302.13,0.11
911717004222091264,"Democrats are laughingly saying that McCain had a ""moment of courage."" Tell that to the people of Arizona who were deceived. 116% increase!",2017-09-25,50302.13,0.11
912280282224525312,"The issue of kneeling has nothing to do with race. It is about respect for our Country, Flag and National Anthem. NFL must respect this!",2017-09-25,50302.13,0.11
912079629648883712,"Alaska, Arizona, Maine and Kentucky are big winners in the Healthcare proposal. 7 years of Repeal and Replace and some Senators not there.",2017-09-25,50302.13,0.11
912080538755846144,Sports fans should never condone players that do not stand proud for their National Anthem or their Country. NFL should change policy!,2017-09-25,50302.13,0.11
912276850793213952,So proud of NASCAR and its supporters and fans. They won't put up with disrespecting our Country or our Flag - they said it loud and clear!,2017-09-25,50302.13,0.11
912278438127525888,Many people booed the players who kneeled yesterday (which was a small percentage of total). These are fans who demand respect for our Flag!,2017-09-25,50302.13,0.11
912281550712135680,The White House never looked more beautiful than it did returning last night. Important meetings taking place today. Big tax cuts and reform.,2017-09-25,50302.13,0.11
912664574461120512,The NFL has all sorts of rules and regulations. The only way out for them is to set a rule that you can't kneel during our National Anthem!,2017-09-26,50462.58,-0.02
912711807709667331,Honored to welcome Republican and Democrat members of the House Ways and Means Committee to the White House today! #USA ,2017-09-26,50462.58,-0.02
912651215997202432,"Thank you to Carmen Yulin Cruz, the Mayor of San Juan, for your kind words on FEMA etc.We are working hard. Much food and water there/on way",2017-09-26,50462.58,-0.02
912792478096302080,America's hearts and prayers are with the people of #PuertoRico and the #USVI. We will get through this - and we will get through this TOGETHER! ,2017-09-26,50462.58,-0.02
912443217227976704,".@CNN is #FakeNews. Just reported COS (John Kelly) was opposed to my stance on NFL players disrespecting FLAG, ANTHEM, COUNTRY. Total lie!",2017-09-26,50462.58,-0.02
912626731357540353,"The booing at the NFL football game last night, when the entire Dallas team dropped to its knees, was loudest I have ever heard. Great anger",2017-09-26,50462.58,-0.02
912624892239077376,"Ratings for NFL football are way down except before game starts, when people tune in to see whether or not our country will be disrespected!",2017-09-26,50462.58,-0.02
912487929783754755,A few of the many clips of John McCain talking about Repealing and Replacing O'Care. My oh my has he changed-complete turn from years of talk! ,2017-09-26,50462.58,-0.02
912478274508423168,"Texas and Florida are doing great but Puerto Rico, which was already suffering from broken infrastructure and massive debt, is in deep trouble It's old electrical grid, which was in terrible shape, was devastated. Much of the Island was destroyed, with billions of dollars owed to Wall Street and the banks which, sadly, must be dealt with. Food, water and medical are top priorities - and doing well. #FEMA",2017-09-26,50462.58,-0.02
912443924979077120,Tremendous backlash against the NFL and its players for disrespect of our Country.#StandForOurAnthem,2017-09-26,50462.58,-0.02
912443607084404736,General John Kelly totally agrees w/ my stance on NFL players and the fact that they should not be disrespecting our FLAG or GREAT COUNTRY!,2017-09-26,50462.58,-0.02
912629775629418501,"But while Dallas dropped to its knees as a team, they all stood up for our National Anthem. Big progress being made-we all love our country!",2017-09-26,50462.58,-0.02
913004378486984704,"We will have the votes for Healthcare but not for the reconciliation deadline of Friday, after which we need 60. Get rid of Filibuster Rule!",2017-09-27,50336.32,-0.38
913003340451188737,"With one Yes vote in hospital and very positive signs from Alaska and two others (McCain is out), we have the HCare Vote, but not for Friday!",2017-09-27,50336.32,-0.38
912997506900021248,Spoke to Jerry Jones of the Dallas Cowboys yesterday. Jerry is a winner who knows how to get things done. Players will stand for Country!,2017-09-27,50336.32,-0.38
912863676792786946,"Congratulations to Roy Moore on his Republican Primary win in Alabama. Luther Strange started way back and ran a good race. Roy, WIN in Dec!",2017-09-27,50336.32,-0.38
912825663694016522,Thank you to our wonderful team @USUN and their families. Keep up the GREAT work! #USA ,2017-09-27,50336.32,-0.38
912807096885723137,I want to express our support and extend our prayers to all those affected by the vile terror attack in Spain last month. ,2017-09-27,50336.32,-0.38
912994446219898880,Spoke to Roy Moore of Alabama last night for the first time. Sounds like a really great guy who ran a fantastic race. He will help to #MAGA!,2017-09-27,50336.32,-0.38
913403237033742336,The electric power grid in Puerto Rico is totally shot. Large numbers of generators are now on Island. Food and water on site.,2017-09-28,50063.83,-0.06
913220484640182272,"It is time to take care of OUR people, to rebuild OUR NATION, and to fight for OUR GREAT AMERICAN WORKERS! #TaxReform #USA ",2017-09-28,50063.83,-0.06
913187235452690432,"This is the right TAX CUT @ the RIGHT TIME. We will ALL succeed and grow TOGETHER - as one team, one people, and one American family. #TaxReform ",2017-09-28,50063.83,-0.06
913371663789625344,Democrats don't want massive tax cuts - how does that win elections? Great reviews for Tax Cut and Reform Bill.,2017-09-28,50063.83,-0.06
913549374227181568,FEMA and First Responders are doing a GREAT job in Puerto Rico. Massive food and water delivered. Docks and electric grid dead. Locals trying really hard to help but many have lost their homes. Military is now on site and I will be there Tuesday. Wish press would treat fairly!,2017-09-29,50064.82,0.42
913757869627133953,"Thank you to FEMA, our great Military and all First Responders who are working so hard,against terrible odds,in Puerto Rico. See you Tuesday!",2017-09-29,50064.82,0.42
914227642131509248,Results of recovery efforts will speak much louder than complaints by San Juan Mayor. Doing everything we can to help great people of PR!,2017-10-02,50499.17,0.31
914217658517737472,We must all be united in offering assistance to everyone suffering in Puerto Rico and elsewhere in the wake of this terrible disaster.,2017-10-02,50499.17,0.31
914210813237489666,Just spoke to Governor Kenneth Mapp of the U.S. Virgin Islands who stated that #FEMA and Military are doing a GREAT job! Thank you Governor!,2017-10-02,50499.17,0.31
914208123564494850,"The Governor of Puerto Rico, Ricardo Rossello, is a great guy and leader who is really working hard. Thank you Ricky!",2017-10-02,50499.17,0.31
914096428879933440,I will be going to Puerto Rico on Tuesday with Melania. Will hopefully be able to stop at the U.S. Virgin Islands (people working hard).,2017-10-02,50499.17,0.31
914094625488502784,"Fake News CNN and NBC are going out of their way to disparage our great First Responders as a way to ""get Trump."" Not fair to FR or effort!",2017-10-02,50499.17,0.31
914087234869047296,"The Mayor of San Juan, who was very complimentary only a few days ago, has now been told by the Democrats that you must be nasty to Trump Such poor leadership ability by the Mayor of San Juan, and others in Puerto Rico, who are not able to get their workers to help. They want everything to be done for them when it should be a community effort. 10,000 Federal workers now on Island doing a fantastic job.",2017-10-02,50499.17,0.31
914465475777695744,"We have done a great job with the almost impossible situation in Puerto Rico. Outside of the Fake News or politically motivated ingrates, people are now starting to recognize the amazing work that has been done by FEMA and our great Military. All buildings now inspected for safety. Thank you to the Governor of P.R. and to all of those who are working so closely with our First Responders. Fantastic job!",2017-10-02,50499.17,0.31
914255264282480640,"Very important that NFL players STAND tomorrow, and always, for the playing of our National Anthem. Respect our Flag and our Country!",2017-10-02,50499.17,0.31
914497877543735296,"I told Rex Tillerson, our wonderful Secretary of State, that he is wasting his time trying to negotiate with Little Rocket Man Save your energy Rex, we'll do what has to be done!",2017-10-02,50499.17,0.31
914565910798782465,"Being nice to Rocket Man hasn't worked in 25 years, why would it work now? Clinton failed, Bush failed, and Obama failed. I won't fail.",2017-10-02,50499.17,0.31
914810093874671617,My warmest condolences and sympathies to the victims and families of the terrible Las Vegas shooting. God bless you!,2017-10-02,50499.17,0.31
915326171063242752,Leaving Puerto Rico now for D.C. Will be in Las Vegas early tomorrow to pay my respects. Everyone is in my thoughts and prayers. ,2017-10-03,50593.54,0.23
915596990674849792,The @NBCNews story has just been totally refuted by Sec. Tillerson and @VP Pence. It is #FakeNews. They should issue an apology to AMERICA!,2017-10-04,50653.53,-0.1
915604746936967168,I will be landing in Las Vegas shortly to pay my respects with @FLOTUS Melania. Everyone remains in our thoughts and prayers.,2017-10-04,50653.53,-0.1
915589297096536065,NBC news is #FakeNews and more dishonest than even CNN. They are a disgrace to good reporting. No wonder their news ratings are way down!,2017-10-04,50653.53,-0.1
915371086249971712,"It is a ""miracle"" how fast the Las Vegas Metropolitan Police were able to find the demented shooter and stop him from even more killing!",2017-10-04,50653.53,-0.1
915379231454003200,My Administration will continue to work around the clock with Governor @RicardoRossello and his team. Great progress being made! #PRStrong ,2017-10-04,50653.53,-0.1
915539424406114304,"Wow, so many Fake News stories today. No matter what I do or say, they will not write or speak truth. The Fake News Media is out of control!",2017-10-04,50653.53,-0.1
915745470689005573,"On behalf of a GRATEFUL NATION, THANK YOU to all of the First Responders (HEROES) who saved countless lives in Las Vegas on Sunday night. ",2017-10-05,50631.36,-0.17
915890389269254145,"So wonderful to be in Las Vegas yesterday and meet with people, from police to doctors to the victims themselves, who I will never forget!",2017-10-05,50631.36,-0.17
915896809536589824,Stock Market hits an ALL-TIME high! Unemployment lowest in 16 years! Business and manufacturing enthusiasm at highest level in decades!,2017-10-05,50631.36,-0.17
916750042014404608,"Presidents and their administrations have been talking to North Korea for 25 years, agreements made and massive amounts of money paid hasn't worked, agreements violated before the ink was dry, makings fools of U.S. negotiators. Sorry, but only one thing will work!",2017-10-09,50584.27,-0.46
916747884716011521,Will be joining @GovMikeHuckabee tonight at 8pmE on @TBN. Enjoy! ,2017-10-09,50584.27,-0.46
916665576940097536,"Our great team at @FEMA is prepared for #HurricaneNate. Everyone in LA, MS, AL, and FL please listen to your local authorities and be safe!",2017-10-09,50584.27,-0.46
916638685914951680,"I called Chuck Schumer yesterday to see if the Dems want to do a great HealthCare Bill. ObamaCare is badly broken, big premiums. Who knows!",2017-10-09,50584.27,-0.46
916635236238274561,More and more people are suggesting that Republicans (and me) should be given Equal Time on T.V. when you look at the one-sided coverage?,2017-10-09,50584.27,-0.46
916634286811435008,"Late Night host are dealing with the Democrats for their very ""unfunny"" and repetitive material, always anti-Trump! Should we get Equal Time?",2017-10-09,50584.27,-0.46
916620603741868032,"Can't believe I finally got a good story in the @washingtonpost. It discusses the enthusiasm of ""Trump"" voters through campaign contributions. The RNC is taking in far more $'s than the Dems, and much of it by my wonderful small donors. I am working hard for them!",2017-10-09,50584.27,-0.46
917026789188399105,"Senator Bob Corker ""begged"" me to endorse him for re-election in Tennessee. I said ""NO"" and he dropped out (said he could not win without my endorsement). He also wanted to be Secretary of State, I said ""NO THANKS."" He is also largely responsible for the horrendous Iran Deal! Hence, I would fully expect Corker to be a negative voice and stand in the way of our great agenda. Didn't have the guts to run!",2017-10-09,50584.27,-0.46
917091286607433728,"I asked @VP Pence to leave stadium if any players kneeled, disrespecting our country. I am proud of him and @SecondLady Karen.",2017-10-09,50584.27,-0.46
917114761057357824,FEMA and first responders are working hard (yet again) on Hurricane Nate. Military helping. Very much under control!,2017-10-09,50584.27,-0.46
917130468025348096,"Bob Corker gave us the Iran Deal, and that's about it. We need HealthCare, we need Tax Cuts/Reform, we need people that can get the job done!",2017-10-09,50584.27,-0.46
917341511754436609,"Our country has been unsuccessfully dealing with North Korea for 25 years, giving billions of dollars and getting nothing. Policy didn't work!",2017-10-09,50584.27,-0.46
917345200414035969,The trip by @VP Pence was long planned. He is receiving great praise for leaving game after the players showed such disrespect for country!,2017-10-09,50584.27,-0.46
917734186848579584,"The Failing @nytimes set Liddle' Bob Corker up by recording his conversation. Was made to sound a fool, and that's what I am dealing with!",2017-10-10,50141.12,-0.18
917698839846576130,"Since Congress can't get its act together on HealthCare, I will be using the power of the pen to give great HealthCare to many people - FAST",2017-10-10,50141.12,-0.18
917694644481413120,"Why is the NFL getting massive tax breaks while at the same time disrespecting our Anthem, Flag and Country? Change tax law!",2017-10-10,50141.12,-0.18
917568245854605313,"A big salute to Jerry Jones, owner of the Dallas Cowboys, who will BENCH players who disrespect our Flag.""Stand for Anthem or sit for game!""",2017-10-10,50141.12,-0.18
918058910673760258,"Stock Market has increased by 5.2 Trillion dollars since the election on November 8th, a 25% increase. Lowest unemployment in 16 years and if Congress gives us the massive tax cuts (and reform) I am asking for, those numbers will grow by leaps and bounds. #MAGA",2017-10-11,50011.5,0.31
918062778522505216,"The Democrats want MASSIVE tax increases and soft, crime producing borders.The Republicans want the biggest tax cut in history and the WALL!",2017-10-11,50011.5,0.31
918065431939829760,It is about time that Roger Goodell of the NFL is finally demanding that all players STAND for our great National Anthem-RESPECT OUR COUNTRY,2017-10-11,50011.5,0.31
918110279367643137,"Fake @NBCNews made up a story that I wanted a ""tenfold"" increase in our U.S. nuclear arsenal. Pure fiction, made up to demean. NBC = CNN!",2017-10-11,50011.5,0.31
918112884630093825,"With all of the Fake News coming out of NBC and the Networks, at what point is it appropriate to challenge their License? Bad for country!",2017-10-11,50011.5,0.31
918201878479073280,Happy to announce we are awarding $1M to Las Vegas - in order to help local law enforcement working OT to respond to last Sunday's tragedy.,2017-10-11,50011.5,0.31
918523263554412544,"The time has come to take action to IMPROVE access, INCREASE choices, and LOWER COSTS for HEALTHCARE! ",2017-10-12,50148.62,-0.35
918428456869916672,"""Puerto Rico survived the Hurricanes, now a financial crisis looms largely of their own making."" says Sharyl Attkisson. A total lack of accountability say the Governor. Electric and all infrastructure was disaster before hurricanes. Congress to decide how much to spend We cannot keep FEMA, the Military and the First Responders, who have been amazing (under the most difficult circumstances) in P.R. forever!",2017-10-12,50148.62,-0.35
918806396875010048,"Hard to believe that the Democrats, who have gone so far LEFT that they are no longer recognizable, are fighting so hard for Sanctuary crime",2017-10-13,50040.4,0.04
918647067224035334,"It is time to take care of OUR COUNTRY, to rebuild OUR COMMUNITIES, and to protect our GREAT AMERICAN WORKERS! #TaxReform ",2017-10-13,50040.4,0.04
918772522983874561,The Democrats ObamaCare is imploding. Massive subsidy payments to their pet insurance companies has stopped. Dems should call me to fix!,2017-10-13,50040.4,0.04
918797009133465600,ObamaCare is a broken mess. Piece by piece we will now begin the process of giving America the great HealthCare it deserves!,2017-10-13,50040.4,0.04
918885859230875649,"In America, we don't worship government - we worship God. #ValuesVotersSummit ",2017-10-13,50040.4,0.04
918894502185787392,"""Consumer confidence soars to highest level since 2004"" ",2017-10-13,50040.4,0.04
918901399080935424,"Today, I announced our strategy to confront the Iranian regime's hostile actions and to ensure that they never acquire a nuclear weapon. ",2017-10-13,50040.4,0.04
919162619889704961,Very proud of my Executive Order which will allow greatly expanded access and far lower costs for HealthCare. Millions of people benefit!,2017-10-16,50029.82,-0.52
919313707355787264,The Democrats in the Southwest part of Virginia have been abandoned by their Party. Republican Ed Gillespie will never let you down!,2017-10-16,50029.82,-0.52
919007577681354752,"Money pouring into Insurance Companies profits, under the guise of ObamaCare, is over. They have made a fortune.Dems must get smart and deal!",2017-10-16,50029.82,-0.52
919005534883328000,"Many people talking, with much agreement, on my Iran speech today. Participants in the deal are making lots of money on trade with Iran!",2017-10-16,50029.82,-0.52
919900022409449474,Art Laffer just said that he doesn't know how a Democrat could vote against the big tax cut/reform bill and live with themselves! @FoxNews,2017-10-16,50029.82,-0.52
