Id,Text,Date,Open,Market_change
869874798087819264,"Kathy Griffin should be ashamed of herself. My children, especially my 11 year old son, Barron, are having a hard time with this. Sick!",2017-05-31,49275.63,-0.99
869902591005741056,"Hopefully Republican Senators, good people all, can quickly get together and pass a new (repeal and replace) HEALTHCARE bill. Add saved $'s.",2017-05-31,49275.63,-0.99
869865463584620544,"So now it is reported that the Democrats, who have excoriated Carter Page about Russia, don't want him to testify. He blows away their case against him and now wants to clear his name by showing ""the false or misleading testimony by James Comey, John Brennan..."" Witch Hunt!",2017-05-31,49275.63,-0.99
870077441401905152,"Crooked Hillary Clinton now blames everybody but herself, refuses to say she was a terrible candidate. Hits Facebook and even Dems and DNC.",2017-06-01,48795.89,0.64
870412262900740096,My job as President is to do everything within my power to give America a level playing field. #AmericaFirst ,2017-06-02,49100.82,0.44
871145660036378624,"Whatever the United States can do to help out in London and the U. K., we will be there - WE ARE WITH YOU. GOD BLESS!",2017-06-05,49244.27,0.56
871328428963901440,"At least 7 dead and 48 wounded in terror attack and Mayor of London says there is ""no reason to be alarmed!""",2017-06-05,49244.27,0.56
871725780535062528,"Pathetic excuse by London Mayor Sadiq Khan who had to think fast on his ""no reason to be alarmed"" statement. MSM is working hard to sell it!",2017-06-05,49244.27,0.56
872147965451882496,Today we remember the courage and bravery of our troops that stormed the beaches of Normandy 73 years ago. #DDay #Heroes ,2017-06-06,49566.33,-0.75
872064426568036353,"Sorry folks, but if I would have relied on the Fake News of CNN, NBC, ABC, CBS, washpost or nytimes, I would have had ZERO chance winning WH",2017-06-06,49566.33,-0.75
872084870620520448,"So good to see the Saudi Arabia visit with the King and 50 countries already paying off. They said they would take a hard line on funding extremism, and all reference was pointing to Qatar. Perhaps this will be the beginning of the end to the horror of terrorism!",2017-06-06,49566.33,-0.75
872059997429022722,The FAKE MSM is working so hard trying to get me not to use Social Media. They hate that I can get the honest and unfiltered message out.,2017-06-06,49566.33,-0.75
872043300949295104,Big meeting today with Republican leadership concerning Tax Cuts and Healthcare. We are all pushing hard - must get it right!,2017-06-06,49566.33,-0.75
872258719404482561,Senate passed the VA Accountability Act. The House should get this bill to my desk ASAP! We can't tolerate substandard care for our vets.,2017-06-07,49194.22,0.11
872427222392504320,"Getting ready to leave for Cincinnati, in the GREAT STATE of OHIO, to meet with ObamaCare victims and talk Healthcare and also Infrastructure!",2017-06-07,49194.22,0.11
873250570508922880,A great honor to host and welcome leaders from around America to the @WhiteHouse Infrastructure Summit. #InfrastructureWeek ,2017-06-09,49046.86,-0.01
873245481488535554,"An honor to join the @FaithandFreedom Coalition yesterday. In America, we don't worship government. We worship God. #FaithandFreedom ",2017-06-09,49046.86,-0.01
873120139222306817,"Despite so many false statements and lies, total and complete vindication...and WOW, Comey is a leaker!",2017-06-09,49046.86,-0.01
873183401620230144,Congratulations to Jeb Hensarling and Republicans on successful House vote to repeal major parts of the 2010 Dodd-Frank financial law. GROWTH!,2017-06-09,49046.86,-0.01
873311842956914688,"It is time to rebuild OUR country, to bring back OUR jobs, to restore OUR dreams, and yes, to put #AmericaFirst! TY Ohio! #InfrastructureWeek ",2017-06-12,49073.66,0.1
873353586025132038,"Time to start building in our country, with American workers and with American iron, aluminum and steel. It is time to put #AmericaFirst ",2017-06-12,49073.66,0.1
873878061778907137,"The #FakeNews MSM doesn't report the great economic news since Election Day. #DOW up 16%. #NASDAQ up 19.5%. Drilling and energy sector way up. Regulations way down. 600,000+ new jobs added. Unemployment down to 4.3%. Business and economic enthusiasm way up- record levels!",2017-06-12,49073.66,0.1
873879934040780801,I believe the James Comey leaks will be far more prevalent than anyone ever thought possible. Totally illegal? Very 'cowardly!',2017-06-12,49073.66,0.1
874084433460154368,"My daughter, Ivanka, will be on @foxandfriends tomorrow morning. Enjoy!",2017-06-12,49073.66,0.1
874087477807599616,"Great numbers on the economy. All of our work, including the passage of many bills and regulation killing Executive Orders, now kicking in!",2017-06-12,49073.66,0.1
874373283919089664,"Finally held our first full @Cabinet meeting today. With this great team, we can restore American prosperity and bring real change to D.C. ",2017-06-12,49073.66,0.1
874608587473080320,A.G. Lynch made law enforcement decisions for political purposes...gave Hillary Clinton a free pass and protection. Totally illegal!,2017-06-13,49183.47,-0.21
874576057579565056,The Fake News Media has never been so wrong or so dirty. Purposely incorrect stories and phony sources to meet their agenda of hate. Sad!,2017-06-13,49183.47,-0.21
875321478849363968,You are witnessing the single greatest WITCH HUNT in American political history - led by some very bad and conflicted people! #MAGA,2017-06-15,49233.21,-0.31
875438639823675392,"Why is that Hillary Clintons family and Dems dealings with Russia are not looked at, but my non-dealings are?",2017-06-15,49233.21,-0.31
875701471999864833,I am being investigated for firing the FBI Director by the man who told me to fire the FBI Director! Witch Hunt,2017-06-16,49134.1,0.17
875690204564258816,The Fake News Media hates when I use what has turned out to be my very powerful Social Media - over 100 million people! I can go around them,2017-06-16,49134.1,0.17
875698062030778368,"Despite the phony Witch Hunt going on in America, the economic and jobs numbers are great. Regulations way down, jobs and enthusiasm way up!",2017-06-16,49134.1,0.17
875888258407858176,Back from Miami where my Cuban/American friends are very happy with what I signed today. Another campaign promise that I did not forget!,2017-06-19,49231.61,-0.1
876079184417882116,Thoughts and prayers with the sailors of USS Fitzgerald and their families. Thank you to our Japanese allies for their assistance. ,2017-06-19,49231.61,-0.1
876388733607694336,"The MAKE AMERICA GREAT AGAIN agenda is doing very well despite the distraction of the Witch Hunt. Many new jobs, high business enthusiasm, massive regulation cuts, 36 new legislative bills signed, great new S.C.Justice, and Infrastructure, Healthcare and Tax Cuts in works!",2017-06-19,49231.61,-0.1
876558049565188096,Camp David is a very special place. An honor to have spent the weekend there. Military runs it so well and are so proud of what they do!,2017-06-19,49231.61,-0.1
876778344636928000,"The Dems want to stop tax cuts, good healthcare and Border Security.Their ObamaCare is dead with 100% increases in P's. Vote now for Karen H",2017-06-19,49231.61,-0.1
876964061027684352,"Big day tomorrow in Georgia and South Carolina. ObamaCare is dead. Dems want to raise taxes big! They can only obstruct, no ideas. Vote ""R""",2017-06-20,49209.62,-0.28
877101173412638720,"Democrat Jon Ossoff, who wants to raise your taxes to the highest level and is weak on crime and security, doesn't even live in district.",2017-06-20,49209.62,-0.28
877104262463008771,"KAREN HANDEL FOR CONGRESS. She will fight for lower taxes, great healthcare strong security-a hard worker who will never give up! VOTE TODAY",2017-06-20,49209.62,-0.28
877234140483121152,"While I greatly appreciate the efforts of President Xi and China to help with North Korea, it has not worked out. At least I know China tried!",2017-06-20,49209.62,-0.28
877474368661618688,"Democrats would do much better as a party if they got together with Republicans on Healthcare,Tax Cuts,Security. Obstruction doesn't work!",2017-06-21,48958.71,-0.1
877341043171241984,It was a great honor to welcome President Petro Poroshenko of Ukraine to the @WhiteHouse today with @VP Pence. ,2017-06-21,48958.71,-0.1
877878375045447680,Former Homeland Security Advisor Jeh Johnson is latest top intelligence official to state there was no grand scheme between Trump and Russia.,2017-06-22,48933.08,0.07
877879361130688512,"By the way, if Russia was working so hard on the 2016 Election, it all took place during the Obama Admin. Why didn't they stop them? Why did Democratic National Committee turn down the DHS offer to protect against hacks (long prior to election). It's all a big Dem HOAX! Why did the DNC REFUSE to turn over its Server to the FBI, and still hasn't? It's all a big Dem scam and excuse for losing the election!",2017-06-22,48933.08,0.07
877892883352702976,I certainly hope the Democrats do not force Nancy P out. That would be very bad for the Republican Party - and please let Cryin' Chuck stay!,2017-06-22,48933.08,0.07
877932907137966080,"With all of the recently reported electronic surveillance, intercepts, unmasking and illegal leaking of information, I have no idea whether there are ""tapes"" or recordings of my conversations with James Comey, but I did not make, and do not have, any such recordings.",2017-06-22,48933.08,0.07
878006964072189952,"As promised, our campaign against the MS-13 gang continues. ""@ICEgov Busts 39 MS-13 Members in New York Operation""",2017-06-22,48933.08,0.07
878019881353871360,"I am very supportive of the Senate #HealthcareBill. Look forward to making it really special! Remember, ObamaCare is dead.",2017-06-23,48938.38,-0.07
878200921980891136,"I've helped pass and signed 38 Legislative Bills, mostly with no Democratic support, and gotten rid of massive amounts of regulations. Nice!",2017-06-23,48938.38,-0.07
878341007103987712,"Today, it was a tremendous honor for me to sign the #VAaccountability Act into law, delivering my campaign promise to our #AmericanHeroes! ",2017-06-23,48938.38,-0.07
878717095701336064,I cannot imagine that these very fine Republican Senators would allow the American people to suffer a broken ObamaCare any longer!,2017-06-26,48806.04,0.38
878715504063643648,"Obama Administration official said they ""choked"" when it came to acting on Russian meddling of election. They didn't want to hurt Hillary?",2017-06-26,48806.04,0.38
878596457741287424,"Democrats slam GOP healthcare proposal as Obamacare premiums and deductibles increase by over 100%. Remember keep your doctor, keep your plan?",2017-06-26,48806.04,0.38
878711517537083392,"Since the Obama Administration was told way before the 2016 Election that the Russians were meddling, why no action? Focus on them, not T!",2017-06-26,48806.04,0.38
878946025662296064,Hillary Clinton colluded with the Democratic Party in order to beat Crazy Bernie Sanders. Is she allowed to so collude? Unfair to Bernie!,2017-06-26,48806.04,0.38
879317636164841474,"The reason that President Obama did NOTHING about Russia after being notified by the CIA of meddling is that he expected Clinton would win and did not want to ""rock the boat."" He didn't ""choke,"" he colluded or obstructed, and it did the Dems and Crooked Hillary no good.",2017-06-26,48806.04,0.38
879326984794517507,"Republican Senators are working very hard to get there, with no help from the Democrats. Not easy! Perhaps just let OCare crash and burn!",2017-06-26,48806.04,0.38
879525817361068032,"From @FoxNews ""Bombshell: In 2016, Obama dismissed idea that anyone could rig an American election."" Check out his statement - Witch Hunt!",2017-06-27,49179.01,-0.16
879678356450676736,Fake News CNN is looking at big management changes now that they got caught falsely pushing their phony Russian stories. Ratings way down!,2017-06-27,49179.01,-0.16
879682547235651584,"So they caught Fake News CNN cold, but what about NBC, CBS and ABC? What about the failing @nytimes and @washingtonpost? They are all Fake News!",2017-06-27,49179.01,-0.16
879827411008974852,"With ZERO Democrats to help, and a failed, expensive and dangerous ObamaCare as the Dems legacy, the Republican Senators are working hard!",2017-06-28,49129.56,0.51
880017678978736129,"Some of the Fake News Media likes to say that I am not totally engaged in healthcare. Wrong, I know the subject well and want victory for U.S.",2017-06-28,49129.56,0.51
879828637733793793,"I just finished a great meeting with the Republican Senators concerning HealthCare. They really want to get it right, unlike OCare!",2017-06-28,49129.56,0.51
880192282254872576,"From my first day in office, we've taken swift action to lift the crushing restrictions on American energy. Remarks: ",2017-06-29,49380.5,-0.29
880469342835666944,"Today, the House votes on two crucial bills: #NoSanctuaryForCriminalsAct #KatesLaw Pass these bills and lets MAKE AMERICA SAFE AGAIN ",2017-06-29,49380.5,-0.29
880534684479897600,"""Mattis Says Trump's Warning Stopped Chemical Weapons Attack In Syria"" ",2017-06-29,49380.5,-0.29
880853246126022656,"I am encouraged by President Moon's assurances that he will work to level the playing field for American workers, businesses, and automakers. ",2017-06-30,49255.08,1.34
880892632142143490,The era of strategic patience with the North Korea regime has failed. That patience is over. We are working closely with.... ,2017-06-30,49255.08,1.34
880737163247267840,"If Republican Senators are unable to pass what they are working on now, they should immediately REPEAL, and then REPLACE at a later date!",2017-06-30,49255.08,1.34
881135264441257984,Word is that @Greta Van Susteren was let go by her out of control bosses at @NBC and @Comcast because she refused to go along w/ 'Trump hate!',2017-07-03,49831.53,0.5
881140479454310401,"Crazy Joe Scarborough and dumb as a rock Mika are not bad people, but their low rated show is dominated by their NBC bosses. Too bad!",2017-07-03,49831.53,0.5
881271748280365056,"The FAKE and FRAUDULENT NEWS MEDIA is working hard to convince Republicans and others I should not use social media - but remember, I won .the 2016 election with interviews, speeches and social media. I had to beat #FakeNews, and did. We will continue to WIN!",2017-07-03,49831.53,0.5
881697281233354753,"America's men and women in uniform is the story of FREEDOM overcoming OPPRESSION, the STRONG protecting the WEAK, and GOOD defeating EVIL!USA ",2017-07-03,49831.53,0.5
881834692282109953,Spoke yesterday with the King of Saudi Arabia about peace in the Middle-East. Interesting things are happening!,2017-07-03,49831.53,0.5
882061157900718081,North Korea has just launched another missile. Does this guy have anything better to do with his life? Hard to believe that South Korea .and Japan will put up with this much longer. Perhaps China will put a heavy move on North Korea and end this nonsense once and for all!,2017-07-04,49999.07,-0.13
882558219285131265,The United States made some of the worst Trade Deals in world history.Why should we continue these deals with countries that do not help us?,2017-07-05,50065.52,0.52
883012994145280000,THE WEST WILL NEVER BE BROKEN. Our values will PREVAIL. Our people will THRIVE and our civilization will TRIUMPH! ,2017-07-06,50268.95,-0.57
883229270943911936,Everyone here is talking about why John Podesta refused to give the DNC server to the FBI and the CIA. Disgraceful!,2017-07-07,50042.53,0.09
883761448064864257,"Leaving Hamburg for Washington, D.C. and the WH. Just left China's President Xi where we had an excellent meeting on trade and North Korea.",2017-07-10,50058.7,1.11
884016887692234753,"Putin and I discussed forming an impenetrable Cyber Security unit so that election hacking, and many other negative things, will be guarded and safe. Questions were asked about why the CIA and FBI had to ask the DNC 13 times for their SERVER, and were rejected, still don't have it. Fake News said 17 intel agencies when actually 4 (had to apologize). Why did Obama do NOTHING when he had info before election?",2017-07-10,50058.7,1.11
884141905436696576,"For years, even as a ""civilian,"" I listened as Republicans pushed the Repeal and Replace of ObamaCare. Now they finally have their chance!",2017-07-10,50058.7,1.11
884361623514656769,James Comey leaked CLASSIFIED INFORMATION to the media. That is so illegal!,2017-07-10,50058.7,1.11
884374529660903424,"When I left Conference Room for short meetings with Japan and other countries, I asked Ivanka to hold seat. Very standard. Angela M agrees!",2017-07-10,50058.7,1.11
884378624660582405,"If Chelsea Clinton were asked to hold the seat for her mother,as her mother gave our country away, the Fake News would say CHELSEA FOR PRES!",2017-07-10,50058.7,1.11
884740553040175104,Working hard to get the Olympics for the United States (L.A.). Stay tuned!,2017-07-11,50545.51,-0.21
885128373441355777,Why aren't the same standards placed on the Democrats. Look what Hillary Clinton may have gotten away with. Disgraceful!,2017-07-12,50847.95,0.59
885131482397908992,"The W.H. is functioning perfectly, focused on HealthCare, Tax Cuts/Reform and many other things. I have very little time for watching T.V.",2017-07-12,50847.95,0.59
885274148012011520,Stock market hits another high with spirit and enthusiasm so positive. Jobs outlook looking very good! #MAGA ,2017-07-13,50820.85,0.31
885570979975639040,"President @EmmanuelMacron,Thank you for the beautiful welcome ceremony at Les Invalides today! ",2017-07-13,50820.85,0.31
885579818875670528,Great bilateral meetings at elysee Palace w/ President @EmmanuelMacron. The friendship between our two nations and ourselves is unbreakable. ,2017-07-13,50820.85,0.31
885858247277727746,"Great conversations with President @EmmanuelMacron and his representatives on trade, military and security.",2017-07-14,50966.87,0.38
885856351557210112,"The United States mourns for the victims of Nice, France. We pledge our solidarity with France against terror. ",2017-07-14,50966.87,0.38
885817217455140864,It was a great honor to represent the United States at the magnificent #BastilleDay parade. Congratulations President @EmmanuelMacron! ,2017-07-14,50966.87,0.38
885773130723205120,.@VP Mike Pence is working hard on HealthCare and getting our wonderful Republican Senators to do what is right for the people.,2017-07-14,50966.87,0.38
885772727315030020,"After all of these years of suffering thru ObamaCare, Republican Senators must come through as they have promised!",2017-07-14,50966.87,0.38
885772254017187840,"So impt Rep Senators, under leadership of @SenateMajLdr McConnell get healthcare plan approved. After 7yrs of O'Care disaster, must happen!",2017-07-14,50966.87,0.38
885770227514052608,"Republicans Senators are working hard to get their failed ObamaCare replacement approved. I will be at my desk, pen in hand!",2017-07-14,50966.87,0.38
885769944482414593,Great evening with President @EmmanuelMacron and Mrs. Macron. Went to Eiffel Tower for dinner. Relationship with France stronger than ever. ,2017-07-14,50966.87,0.38
885988016912838656,"Just landed from Paris, France. It was an incredible visit with President @EmmanuelMacron. A lot discussed and accomplished in two days!",2017-07-17,51141.63,0.33
885992108565291008,"President @EmmanuelMacron,Thank you for inviting Melania and myself to such a historic celebration in France. #BastilleDay #14juillet ",2017-07-17,51141.63,0.33
886259363412926464,Stock Market at new all-time high! Working on new trade deals that will be great for U.S. and its workers!,2017-07-17,51141.63,0.33
887134287350439936,Republicans should just REPEAL failing ObamaCare now and work on a new Healthcare Plan that will start from a clean slate. Dems will join in!,2017-07-18,51228.36,-0.45
887279050263285761,"We were let down by all of the Democrats and a few Republicans. Most Republicans were loyal, terrific and worked really hard. We will return!",2017-07-18,51228.36,-0.45
887280380423938048,"As I have always said, let ObamaCare fail and then come together and do a great healthcare plan. Stay tuned!",2017-07-18,51228.36,-0.45
887299895803203584,"With only a very small majority, the Republicans in the House and Senate need more victories next year since Dems totally obstruct, no votes!",2017-07-18,51228.36,-0.45
887302632687251456,The Senate must go to a 51 vote majority instead of current 60 votes. Even parts of full Repeal need 60. 8 Dems control Senate. Crazy!,2017-07-18,51228.36,-0.45
887650824515661824,I will be having lunch at the White House today with Republican Senators concerning healthcare. They MUST keep their promise to America!,2017-07-19,51172.91,-0.03
887654816507408384,"The Republicans never discuss how good their healthcare bill is, and it will get even better at lunchtime.The Dems scream death as OCare dies!",2017-07-19,51172.91,-0.03
887862941109940225,"Melania and I send our thoughts and prayers to Senator McCain, Cindy, and their entire family. Get well soon. ",2017-07-20,51163.21,0.11
888088029428150272,"Departing The Pentagon after meetings with @VP Pence, Secretary James Mattis, and our great teams. #MAGA ",2017-07-20,51163.21,0.11
888240051599134721,"Billions of dollars in investments and thousands of new jobs in America! An initiative via Corning, Merck and Pfizer: ",2017-07-21,51180.04,0.82
888771440014749697,Join me live for the commissioning ceremony of the USS Gerald R. Ford! #USA ,2017-07-24,51526.39,0.2
888736256145985536,"ObamaCare is dead and the Democrats are obstructionists, no ideas or votes, only obstruction. It is solely up to the 52 Republican Senators!",2017-07-24,51526.39,0.2
888734848550043648,"The Republican Senators must step up to the plate and, after 7 years, vote to Repeal and Replace. Next, Tax Reform and Infrastructure. WIN!",2017-07-24,51526.39,0.2
888726438265966592,"So many people are asking why isn't the A.G. or Special Council looking at the many Hillary Clinton or Comey crimes. 33,000 e-mails deleted? What about all of the Clinton ties to Russia, including Podesta Company, Uranium deal, Russian Reset, big dollar speeches etc.",2017-07-24,51526.39,0.2
888733031875346432,"In all fairness to Anthony Scaramucci, he wanted to endorse me 1st, before the Republican Primaries started, but didn't think I was running!",2017-07-24,51526.39,0.2
888730468732067841,"My son Donald openly gave his e-mails to the media and authorities whereas Crooked Hillary Clinton deleted (and acid washed) her 33,000 e-mails!",2017-07-24,51526.39,0.2
888713231065391104,"This morning I will be going to the Commissioning Ceremony for the largest aircraft carrier in the world, The Gerald R. Ford. Norfolk, Va.",2017-07-24,51526.39,0.2
888708453560184832,"A new INTELLIGENCE LEAK from the Amazon Washington Post,this time against A.G. Jeff Sessions.These illegal leaks, like Comey's, must stop!",2017-07-24,51526.39,0.2
888724194820857857,"While all agree the U. S. President has the complete power to pardon, why think of that when only crime so far is LEAKS against us.FAKE NEWS",2017-07-24,51526.39,0.2
889215815022727168,"As the phony Russian Witch Hunt continues, two groups are laughing at this excuse for a lost election taking hold, Democrats and Russians!",2017-07-24,51526.39,0.2
889217183930351621,"It's very sad that Republicans, even some that were carried over the line on my back, do very little to protect their President.",2017-07-24,51526.39,0.2
889474780356915206,Republicans have a last chance to do the right thing on Repeal and Replace after years of talking and campaigning on it.,2017-07-24,51526.39,0.2
889473486506385409,"Sleazy Adam Schiff, the totally biased Congressman looking into ""Russia,"" spends all of his time on television pushing the Dem loss excuse!",2017-07-24,51526.39,0.2
889467610332528641,"So why aren't the Committees and investigators, and of course our beleaguered A.G., looking into Crooked Hillarys crimes and Russia relations?",2017-07-24,51526.39,0.2
889274373689028609,"If Republicans don't Repeal and Replace the disastrous ObamaCare, the repercussions will be far greater than any of them understand!",2017-07-24,51526.39,0.2
889273320574783489,"It's hard to read the Failing New York Times or the Amazon Washington Post because every story/opinion, even if should be positive, is bad!",2017-07-24,51526.39,0.2
889800510106107904,"Jared Kushner did very well yesterday in proving he did not collude with the Russians. Witch Hunt. Next up, 11 year old Barron Trump!",2017-07-25,51590.48,0.09
889867842186649600,The American people have waited long enough. There has been enough talk and no action for seven years. Now is the time for action! ,2017-07-25,51590.48,0.09
889822411356602369,This will be a very interesting day for HealthCare.The Dems are obstructionists but the Republicans can have a great victory for the people!,2017-07-25,51590.48,0.09
889821674987761664,Working on major Trade Deal with the United Kingdom. Could be very big and exciting. JOBS! The E.U. is very protectionist with the U.S. STOP!,2017-07-25,51590.48,0.09
889798407228989441,So great that John McCain is coming back to vote. Brave - American hero! Thank you John.,2017-07-25,51590.48,0.09
889824817473605632,Will be traveling to the Great State of Ohio tonight. Big crowd expected. See you there!,2017-07-25,51590.48,0.09
889794300913045508,"Big day for HealthCare. After 7 years of talking, we will soon see whether or not Republicans are willing to step up to the plate!",2017-07-25,51590.48,0.09
889792764363276288,"Problem is that the acting head of the FBI and the person in charge of the Hillary investigation, Andrew McCabe, got $700,000 from H for wife!",2017-07-25,51590.48,0.09
